idx,poem_text,url
486,悲 哉 秋 之 为 气 也 萧 瑟 兮 草 木 摇 落 而 变 衰 憭 栗 兮 若 在 远 行 登 山 临 水 兮 送 将 归 泬 漻 兮 天 高 而 气 清 寂 寥 兮 收 潦 而 水 清 憯 悽 增 欷 兮 薄 寒 之 中 人 怆 怳 懭 悢 兮 去 故 而 就 新 坎 廪 兮 贫 士 失 职 而 志 不 平 廓 落 兮 羁 旅 而 无 友 生 惆 怅 兮 而 私 自 怜 燕 翩 翩 其 辞 归 兮 蝉 寂 漠 而 无 声 雁 廱 廱 而 南 游 兮 鹍 鸡 啁 哳 而 悲 鸣 独 申 旦 而 不 寐 兮 哀 蟋 蟀 之 宵 征 时 亹 亹 而 过 中 兮 蹇 淹 留 而 无 成 悲 忧 穷 戚 兮 独 处 廓 有 美 一 人 兮 心 不 绎 去 乡 离 家 兮 来 远 客 超 逍 遥 兮 今 焉 薄 专 思 君 兮 不 可 化 君 不 知 兮 可 奈 何 蓄 怨 兮 积 思 心 烦 憺 兮 忘 食 事 原 一 见 兮 道 余 意 君 之 心 兮 与 余 异 车 既 驾 兮 朅 而 归 不 得 见 兮 心 伤 悲 倚 结 軨 兮 长 太 息 涕 潺 湲 兮 下 霑 轼 忼 慨 绝 兮 不 得 中 瞀 乱 兮 迷 惑 私 自 怜 兮 何 极 心 怦 怦 兮 谅 直 皇 天 平 分 四 时 兮 窃 独 悲 此 凛 秋 白 露 既 下 百 草 兮 奄 离 披 此 梧 楸 去 白 日 之 昭 昭 兮 袭 长 夜 之 悠 悠 离 芳 蔼 之 方 壮 兮 余 萎 约 而 悲 愁 秋 既 先 戒 以 白 露 兮 冬 又 申 之 以 严 霜 收 恢 台 之 孟 夏 兮 然 欿 傺 而 沉 藏 叶 菸 邑 而 无 色 兮 枝 烦 挐 而 交 横 颜 淫 溢 而 将 罢 兮 柯 仿 佛 而 萎 黄 萷 櫹 椮 之 可 哀 兮 形 销 铄 而 瘀 伤 惟 其 纷 糅 而 将 落 兮 恨 其 失 时 而 无 当 揽 騑 辔 而 下 节 兮 聊 逍 遥 以 相 佯 岁 忽 忽 而 遒 尽 兮 恐 余 寿 之 弗 将 悼 余 生 之 不 时 兮 逢 此 世 之 俇 攘 澹 容 与 而 独 倚 兮 蟋 蟀 鸣 此 西 堂 心 怵 惕 而 震 荡 兮 何 所 忧 之 多 方 卬 明 月 而 太 息 兮 步 列 星 而 极 明 窃 悲 夫 蕙 华 之 曾 敷 兮 纷 旖 旎 乎 都 房 何 曾 华 之 无 实 兮 从 风 雨 而 飞 飏 以 为 君 独 服 此 蕙 兮 羌 无 以 异 于 众 芳 闵 奇 思 之 不 通 兮 将 去 君 而 高 翔 心 闵 怜 之 惨 悽 兮 愿 一 见 而 有 明 重 无 怨 而 生 离 兮 中 结 轸 而 增 伤 岂 不 郁 陶 而 思 君 兮 君 之 门 以 九 重 猛 犬 狺 狺 而 迎 吠 兮 关 梁 闭 而 不 通 皇 天 淫 溢 而 秋 霖 兮 后 土 何 时 而 得 漧 塊 独 守 此 无 泽 兮 仰 浮 云 而 永 叹 何 时 俗 之 工 巧 兮 背 绳 墨 而 改 错 郤 骐 骥 而 不 乘 兮 策 驽 骀 而 取 路 当 世 岂 无 骐 骥 兮 诚 莫 之 能 善 御 见 执 辔 者 非 其 人 兮 故 駶 跳 而 远 去 凫 雁 皆 唼 夫 梁 藻 兮 凤 愈 飘 翔 而 高 举 圜 凿 而 方 枘 兮 吾 固 知 其 鉏 铻 而 难 入 众 鸟 皆 有 所 登 棲 兮 凤 独 遑 遑 而 无 所 集 原 衔 枚 而 无 言 兮 尝 被 君 之 渥 洽 太 公 九 十 乃 显 荣 兮 诚 未 遇 其 匹 合 谓 骐 骥 兮 安 归 谓 凤 皇 兮 安 棲 变 古 易 俗 兮 世 衰 今 之 相 者 兮 举 肥 骐 骥 伏 匿 而 不 见 兮 凤 皇 高 飞 而 不 下 鸟 兽 犹 知 怀 德 兮 何 云 贤 士 之 不 处 骥 不 骤 进 而 求 服 兮 凤 亦 不 贪 餧 而 妄 食 君 弃 远 而 不 察 兮 虽 原 忠 其 焉 得 欲 寂 漠 而 绝 端 兮 窃 不 敢 忘 初 之 厚 德 独 悲 愁 其 伤 人 兮 冯 郁 郁 其 何 极 霜 露 惨 悽 而 交 下 兮 心 尚 幸 其 弗 济 霰 雪 雰 糅 其 增 加 兮 乃 知 遭 命 之 将 至 原 徼 幸 而 有 待 兮 泊 莽 莽 与 野 草 同 死 原 自 往 而 径 游 兮 路 壅 绝 而 不 通 欲 循 道 而 平 驱 兮 又 未 知 其 所 从 然 中 路 而 迷 惑 兮 自 压 桉 而 学 诵 性 愚 陋 以 褊 浅 兮 信 未 达 乎 从 容 窃 美 申 包 胥 之 气 盛 兮 恐 时 世 之 不 固 何 时 俗 之 工 巧 兮 灭 规 矩 而 改 凿 独 耿 介 而 不 随 兮 原 慕 先 圣 之 遗 教 处 浊 世 而 显 荣 兮 非 余 心 之 所 乐 与 其 无 义 而 有 名 兮 宁 穷 处 而 守 高 食 不 媮 而 为 饱 兮 衣 不 苟 而 为 温 窃 慕 诗 人 之 遗 风 兮 原 讬 志 乎 素 餐 蹇 充 倔 而 无 端 兮 泊 莽 莽 而 无 垠 无 衣 裘 以 御 冬 兮 恐 溘 死 不 得 见 乎 阳 春 靓 杪 秋 之 遥 夜 兮 心 缭 悷 而 有 哀 春 秋 逴 逴 而 日 高 兮 然 惆 怅 而 自 悲 四 时 递 来 而 卒 岁 兮 阴 阳 不 可 与 俪 偕 白 日 晼 晚 其 将 入 兮 明 月 销 铄 而 减 毁 岁 忽 忽 而 遒 尽 兮 老 冉 冉 而 愈 弛 心 摇 悦 而 日 幸 兮 然 怊 怅 而 无 冀 中 憯 恻 之 悽 怆 兮 长 太 息 而 增 欷 年 洋 洋 以 日 往 兮 老 嵺 廓 而 无 处 事 亹 亹 而 觊 进 兮 蹇 淹 留 而 踌 躇 何 氾 滥 之 浮 云 兮 猋 壅 蔽 此 明 月 忠 昭 昭 而 原 见 兮 然 霠 曀 而 莫 达 原 皓 日 之 显 行 兮 云 蒙 蒙 而 蔽 之 窃 不 自 聊 而 原 忠 兮 或 黕 点 而 汙 之 尧 舜 之 抗 行 兮 瞭 冥 冥 而 薄 天 何 险 巇 之 嫉 妒 兮 被 以 不 慈 之 伪 名 彼 日 月 之 照 明 兮 尚 黯 黮 而 有 瑕 何 况 一 国 之 事 兮 亦 多 端 而 胶 加 被 荷 裯 之 晏 晏 兮 然 潢 洋 而 不 可 带 既 骄 美 而 伐 武 兮 负 左 右 之 耿 介 憎 愠 惀 之 修 美 兮 好 夫 人 之 慷 慨 众 踥 蹀 而 日 进 兮 美 超 远 而 逾 迈 农 夫 辍 耕 而 容 与 兮 恐 田 野 之 芜 秽 事 緜 緜 而 多 私 兮 窃 悼 後 之 危 败 世 雷 同 而 炫 曜 兮 何 毁 誉 之 昧 昧 今 修 饰 而 窥 镜 兮 後 尚 可 以 竄 藏 愿 寄 言 夫 流 星 兮 羌 倏 忽 而 难 当 卒 壅 蔽 此 浮 云 下 暗 漠 而 无 光 尧 舜 皆 有 所 举 任 兮 故 高 枕 而 自 适 谅 无 怨 于 天 下 兮 心 焉 取 此 怵 惕 乘 骐 骥 之 浏 浏 兮 驭 安 用 夫 强 策 谅 城 郭 之 不 足 恃 兮 虽 重 介 之 何 益 邅 翼 翼 而 无 终 兮 忳 惛 惛 而 愁 约 生 天 地 之 若 过 兮 功 不 成 而 无 嶜 原 沉 滞 而 不 见 兮 尚 欲 布 名 乎 天 下 然 潢 洋 而 不 遇 兮 直 怐 愗 而 自 苦 莽 洋 洋 而 无 极 兮 忽 翱 翔 之 焉 薄 国 有 骥 而 不 知 乘 兮 焉 皇 皇 而 更 索 宁 戚 讴 于 车 下 兮 桓 公 闻 而 知 之 无 伯 乐 之 相 善 兮 今 谁 使 乎 誉 之 罔 流 涕 以 聊 虑 兮 惟 著 意 而 得 之 纷 纯 纯 之 愿 忠 兮 妒 被 离 而 鄣 之 原 赐 不 肖 之 躯 而 别 离 兮 放 游 志 乎 云 中 乘 精 气 之 抟 抟 兮 骛 诸 神 之 湛 湛 骖 白 霓 之 習 習 兮 历 群 灵 之 丰 丰 左 硃 雀 之 茇 茇 兮 右 苍 龙 之 躣 躣 属 雷 师 之 阗 阗 兮 通 飞 廉 之 衙 衙 前 轻 辌 之 锵 锵 兮 后 辎 乘 之 从 从 载 云 旗 之 委 蛇 兮 扈 屯 骑 之 容 容 计 专 专 之 不 可 化 兮 原 遂 推 而 为 臧 赖 皇 天 之 厚 德 兮 还 及 君 之 无 恙,https://so.gushiwen.org/shiwenv_2710bc74dab6.aspx
487,春 欲 尽 日 迟 迟 牡 丹 时 罗 幌 卷 翠 帘 垂 彩 笺 书 红 粉 泪 两 心 知 人 不 在 燕 空 归 负 佳 期 香 烬 落 枕 函 欹 月 分 明 花 淡 薄 惹 相 思,https://so.gushiwen.org/shiwenv_12296c59d5d6.aspx
488,药 名 招 婺 源 马 荀 仲 游 雨 岩 马 善 医 山 路 风 来 草 木 香 雨 余 凉 意 到 胡 床 泉 石 膏 肓 吾 已 甚 多 病 提 防 风 月 费 篇 章 孤 负 寻 常 山 简 醉 独 自 故 应 知 子 草 玄 忙 湖 海 早 知 身 汗 漫 谁 伴 只 甘 松 竹 共 凄 凉,https://so.gushiwen.org/shiwenv_910fe6c063d6.aspx
489,梅 落 繁 枝 千 万 片 犹 自 多 情 学 雪 随 风 转 昨 夜 笙 歌 容 易 散 酒 醒 添 得 愁 无 限 楼 上 春 山 寒 四 面 过 尽 征 鸿 暮 景 烟 深 浅 一 晌 凭 栏 人 不 见 鲛 绡 掩 泪 思 量 遍,https://so.gushiwen.org/shiwenv_0b495c39987f.aspx
490,彼 采 葛 兮 一 日 不 见 如 三 月 兮 彼 采 萧 兮 一 日 不 见 如 三 秋 兮 彼 采 艾 兮 一 日 不 见 如 三 岁 兮,https://so.gushiwen.org/shiwenv_bec4205dd233.aspx
491,春 情 只 到 梨 花 薄 片 片 催 零 落 夕 阳 何 事 近 黄 昏 不 道 人 间 犹 有 未 招 魂 银 笺 别 梦 当 时 句 密 绾 同 心 苣 为 伊 判 作 梦 中 人 索 向 画 图 清 夜 唤 真 真,https://so.gushiwen.org/shiwenv_54b9fc077dcb.aspx
492,绵 绵 瓜 瓞 民 之 初 生 自 土 沮 漆 古 公 亶 父 陶 复 陶 冗 未 有 家 室 古 公 亶 父 来 朝 走 马 率 西 水 浒 至 于 岐 下 爰 及 姜 女 聿 来 胥 宇 周 原 膴 堇 荼 如 饴 爰 始 爰 谋 爰 契 我 龟 曰 止 曰 时 筑 室 于 兹 乃 慰 乃 止 乃 左 乃 右 乃 疆 乃 理 乃 宣 乃 亩 自 西 徂 东 周 爰 执 事 乃 召 司 空 乃 召 司 徒 俾 立 室 家 其 绳 则 直 缩 版 以 载 作 庙 翼 翼 捄 之 陾 度 之 薨 薨 筑 之 登 登 削 屡 冯 冯 百 堵 皆 兴 鼛 鼓 弗 胜 乃 立 皋 门 皋 门 有 伉 乃 立 应 门 应 门 将 将 乃 立 冢 土 戎 丑 攸 行 肆 不 殄 厥 愠 亦 不 陨 厥 问 柞 棫 拔 矣 行 道 兑 矣 混 夷 駾 矣 维 其 喙 矣 虞 芮 质 厥 成 文 王 蹶 厥 生 予 曰 有 疏 附 予 曰 有 先 后 予 曰 有 奔 奏 予 曰 有 御 侮,https://so.gushiwen.org/shiwenv_1a37c047edd6.aspx
493,麦 秀 渐 渐 兮 禾 黍 油 油 彼 狡 童 兮 不 与 我 好 兮,https://so.gushiwen.org/shiwenv_0820a90caa71.aspx
494,胡 人 吹 笛 戍 楼 间 楼 上 萧 条 海 月 闲 借 问 落 梅 凡 几 曲 从 风 一 夜 满 关 山,https://so.gushiwen.org/shiwenv_4339d26e059b.aspx
495,有 女 同 车 颜 如 舜 华 将 翱 将 翔 佩 玉 琼 琚 彼 美 孟 姜 洵 美 且 都 有 女 同 行 颜 如 舜 英 将 翱 将 翔 佩 玉 将 将 彼 美 孟 姜 德 音 不 忘,https://so.gushiwen.org/shiwenv_105d08a95e7d.aspx
496,柴 门 寂 寂 黍 饭 馨 山 家 烟 火 春 雨 晴 庭 花 蒙 蒙 水 泠 泠 小 儿 啼 索 树 上 莺,https://so.gushiwen.org/shiwenv_00aa4d7e0463.aspx
497,洛 城 一 别 四 千 里 胡 骑 长 驱 五 六 年 草 木 变 衰 行 剑 外 兵 戈 阻 绝 老 江 边 思 家 步 月 清 宵 立 忆 弟 看 云 白 日 眠 闻 道 河 阳 近 乘 胜 司 徒 急 为 破 幽 燕,https://so.gushiwen.org/shiwenv_2c5ca34adfcf.aspx
498,步 出 城 东 门 遥 望 江 南 路 前 日 风 雪 中 故 人 从 此 去 我 欲 渡 河 水 河 水 深 无 梁 愿 为 双 黄 鹄 高 飞 还 故 乡,https://so.gushiwen.org/shiwenv_cb2af6b9bbbf.aspx
499,去 者 日 以 疏 来 者 日 以 亲 出 郭 门 直 视 但 见 丘 与 坟 古 墓 犁 为 田 松 柏 摧 为 薪 白 杨 多 悲 风 萧 萧 愁 杀 人 思 还 故 里 闾 欲 归 道 无 因,https://so.gushiwen.org/shiwenv_566eb225e53e.aspx
500,辞 宗 盛 荆 梦 登 歌 美 凫 绎 徒 收 杞 梓 饶 曾 非 羽 人 宅 罗 景 蔼 云 扃 沾 光 扈 龙 策 御 风 亲 列 涂 乘 山 穷 禹 迹 含 啸 对 雾 岑 延 萝 倚 峰 壁 青 冥 摇 烟 树 穹 跨 负 天 石 霜 崖 灭 土 膏 金 涧 测 泉 脉 旋 渊 抱 星 汉 乳 窦 通 海 碧 谷 馆 驾 鸿 人 岩 栖 咀 丹 客 殊 物 藏 珍 怪 奇 心 隐 仙 籍 高 世 伏 音 华 绵 古 遁 精 魄 萧 瑟 生 哀 听 参 差 远 惊 觌 惭 无 献 赋 才 洗 污 奉 毫 帛,https://so.gushiwen.org/shiwenv_9c56557e284b.aspx
501,君 家 全 盛 日 台 鼎 何 陆 离 斩 鳌 翼 娲 皇 炼 石 补 天 维 一 回 日 月 顾 三 入 凤 凰 池 失 势 青 门 傍 种 瓜 复 几 时 犹 会 众 宾 客 三 千 光 路 岐 皇 恩 雪 愤 懑 松 柏 含 荣 滋 我 非 东 床 人 令 姊 忝 齐 眉 浪 迹 未 出 世 空 名 动 京 师 适 遭 云 罗 解 翻 谪 夜 郎 悲 拙 妻 莫 邪 剑 及 此 二 龙 随 惭 君 湍 波 苦 千 里 远 从 之 白 帝 晓 猿 断 黄 牛 过 客 迟 遥 瞻 明 月 峡 西 去 益 相 思,https://so.gushiwen.org/shiwenv_a3ea5d690b51.aspx
502,天 门 开 詄 荡 荡 穆 并 骋 以 临 飨 光 夜 烛 德 信 著 灵 浸 鸿 长 生 豫 太 朱 涂 广 夷 石 为 堂 饰 玉 梢 以 舞 歌 体 招 摇 若 永 望 星 留 俞 塞 陨 光 照 紫 幄 珠 烦 黄 幡 比 翅 回 集 贰 双 飞 常 羊 月 穆 穆 以 金 波 日 华 耀 以 宣 明 假 清 风 轧 忽 激 长 至 重 觞 神 裴 回 若 留 放 殣 冀 亲 以 肆 章 函 蒙 祉 福 常 若 期 寂 谬 上 天 知 厥 时 泛 泛 滇 滇 从 高 斿 殷 勤 此 路 胪 所 求 佻 正 嘉 古 弘 以 昌 休 嘉 砰 隐 溢 四 方 专 精 厉 意 逝 九 阂 纷 云 六 幕 浮 大 海,https://so.gushiwen.org/shiwenv_161c4637caa5.aspx
503,桂 树 丛 生 兮 山 之 幽 偃 蹇 连 蜷 兮 枝 相 缭 山 气 巄 嵷 兮 石 嵯 峨 溪 谷 崭 岩 兮 水 曾 波 猿 狖 群 啸 兮 虎 豹 嗥 攀 援 桂 枝 兮 聊 淹 留 王 孙 游 兮 不 归 春 草 生 兮 萋 萋 岁 暮 兮 不 自 聊 蟪 蛄 鸣 兮 啾 啾 坱 兮 轧 山 曲 岪 心 淹 留 兮 恫 慌 忽 罔 兮 沕 憭 兮 栗 虎 豹 穴 丛 薄 深 林 兮 人 上 栗 嵚 岑 碕 礒 兮 碅 磳 磈 硊 树 轮 相 纠 兮 林 木 茷 骫 青 莎 杂 树 兮 薠 草 靃 靡 白 鹿 麏 麚 兮 或 腾 或 倚 状 貌 崟 崟 兮 峨 峨 凄 凄 兮 漇 漇 猕 猴 兮 熊 罴 慕 类 兮 以 悲 攀 援 桂 枝 兮 聊 淹 留 虎 豹 斗 兮 熊 罴 咆 禽 兽 骇 兮 亡 其 曹 王 孙 兮 归 来 山 中 兮 不 可 以 久 留,https://so.gushiwen.org/shiwenv_6cd1b64b2d68.aspx
504,北 阙 圣 人 歌 太 康 南 冠 君 子 窜 遐 荒 汉 酺 闻 奏 钧 天 乐 愿 得 风 吹 到 夜 郎,https://so.gushiwen.org/shiwenv_2e40c626fc00.aspx
505,闲 梦 远 南 国 正 芳 春 船 上 管 弦 江 面 渌 满 城 飞 絮 辊 轻 尘 忙 杀 看 花 人 闲 梦 远 南 国 正 清 秋 千 里 江 山 寒 色 远 芦 花 深 处 泊 孤 舟 笛 在 月 明 楼,https://so.gushiwen.org/shiwenv_a1482ccb71be.aspx
506,古 木 阴 中 系 短 篷 杖 藜 扶 我 过 桥 东 沾 衣 欲 湿 杏 花 雨 吹 面 不 寒 杨 柳 风,https://so.gushiwen.org/shiwenv_f20c6e290a03.aspx
507,流 莺 漂 荡 复 参 差 度 陌 临 流 不 自 持 巧 啭 岂 能 无 本 意 良 辰 未 必 有 佳 期 风 朝 露 夜 阴 晴 里 万 户 千 门 开 闭 时 曾 苦 伤 春 不 忍 听 凤 城 何 处 有 花 枝,https://so.gushiwen.org/shiwenv_5c6a6e4c7cb2.aspx
508,不 向 长 安 路 上 行 却 教 山 寺 厌 逢 迎 味 无 味 处 求 吾 乐 材 不 材 间 过 此 生 宁 作 我 岂 其 卿 人 间 走 遍 却 归 耕 一 松 一 竹 真 朋 友 山 鸟 山 花 好 弟 兄,https://so.gushiwen.org/shiwenv_f6cc98463871.aspx
509,秋 后 亭 皋 木 叶 稀 霜 前 关 塞 雁 南 归 晓 云 散 去 山 腰 瘦 宿 雨 来 时 水 面 肥 吾 老 矣 久 忘 机 沙 鸥 相 对 不 惊 飞 柳 溪 父 老 应 怜 我 荒 却 溪 南 旧 钓 矶,https://so.gushiwen.org/shiwenv_6d2589515328.aspx
510,元 和 十 年 予 左 迁 九 江 郡 司 马 明 年 秋 送 客 湓 浦 口 闻 舟 中 夜 弹 琵 琶 者 听 其 音 铮 铮 然 有 京 都 声 问 其 人 本 长 安 倡 女 尝 学 琵 琶 于 穆 曹 二 善 才 年 长 色 衰 委 身 为 贾 人 妇 遂 命 酒 使 快 弹 数 曲 曲 罢 悯 然 自 叙 少 小 时 欢 乐 事 今 漂 沦 憔 悴 转 徙 于 江 湖 间 予 出 官 二 年 恬 然 自 安 感 斯 人 言 是 夕 始 觉 有 迁 谪 意 因 为 长 句 歌 以 赠 之 凡 六 百 一 十 六 言 命 曰 琵 琶 行 浔 阳 江 头 夜 送 客 枫 叶 荻 花 秋 瑟 瑟 主 人 下 马 客 在 船 举 酒 欲 饮 无 管 弦 醉 不 成 欢 惨 将 别 别 时 茫 茫 江 浸 月 忽 闻 水 上 琵 琶 声 主 人 忘 归 客 不 发 寻 声 暗 问 弹 者 谁 琵 琶 声 停 欲 语 迟 移 船 相 近 邀 相 见 添 酒 回 灯 重 开 宴 千 呼 万 唤 始 出 来 犹 抱 琵 琶 半 遮 面 转 轴 拨 弦 三 两 声 未 成 曲 调 先 有 情 弦 弦 掩 抑 声 声 思 似 诉 平 生 不 得 志 不 得 志 一 作 不 得 意 低 眉 信 手 续 续 弹 说 尽 心 中 无 限 事 轻 拢 慢 捻 抹 复 挑 初 为 霓 裳 后 六 幺 六 幺 一 作 绿 腰 大 弦 嘈 嘈 如 急 雨 小 弦 切 切 如 私 语 嘈 嘈 切 切 错 杂 弹 大 珠 小 珠 落 玉 盘 间 关 莺 语 花 底 滑 幽 咽 泉 流 冰 下 难 冰 泉 冷 涩 弦 凝 绝 凝 绝 不 通 声 暂 歇 别 有 幽 愁 暗 恨 生 此 时 无 声 胜 有 声 银 瓶 乍 破 水 浆 迸 铁 骑 突 出 刀 枪 鸣 曲 终 收 拨 当 心 画 四 弦 一 声 如 裂 帛 东 船 西 舫 悄 无 言 唯 见 江 心 秋 月 白 沉 吟 放 拨 插 弦 中 整 顿 衣 裳 起 敛 容 自 言 本 是 京 城 女 家 在 虾 蟆 陵 下 住 十 三 学 得 琵 琶 成 名 属 教 坊 第 一 部 曲 罢 曾 教 善 才 服 妆 成 每 被 秋 娘 妒 五 陵 年 少 争 缠 头 一 曲 红 绡 不 知 数 钿 头 银 篦 击 节 碎 血 色 罗 裙 翻 酒 污 今 年 欢 笑 复 明 年 秋 月 春 风 等 闲 度 弟 走 从 军 阿 姨 死 暮 去 朝 来 颜 色 故 门 前 冷 落 鞍 马 稀 老 大 嫁 作 商 人 妇 商 人 重 利 轻 别 离 前 月 浮 梁 买 茶 去 去 来 江 口 守 空 船 绕 船 月 明 江 水 寒 夜 深 忽 梦 少 年 事 梦 啼 妆 泪 红 阑 干 我 闻 琵 琶 已 叹 息 又 闻 此 语 重 唧 唧 同 是 天 涯 沦 落 人 相 逢 何 必 曾 相 识 我 从 去 年 辞 帝 京 谪 居 卧 病 浔 阳 城 浔 阳 地 僻 无 音 乐 终 岁 不 闻 丝 竹 声 住 近 湓 江 地 低 湿 黄 芦 苦 竹 绕 宅 生 其 间 旦 暮 闻 何 物 杜 鹃 啼 血 猿 哀 鸣 春 江 花 朝 秋 月 夜 往 往 取 酒 还 独 倾 岂 无 山 歌 与 村 笛 呕 哑 嘲 哳 难 为 听 今 夜 闻 君 琵 琶 语 如 听 仙 乐 耳 暂 明 莫 辞 更 坐 弹 一 曲 为 君 翻 作 琵 琶 行 感 我 此 言 良 久 立 却 坐 促 弦 弦 转 急 凄 凄 不 似 向 前 声 满 座 重 闻 皆 掩 泣 座 中 泣 下 谁 最 多 江 州 司 马 青 衫 湿,https://so.gushiwen.org/shiwenv_0581b0ba8bb4.aspx
511,清 时 有 味 是 无 能 闲 爱 孤 云 静 爱 僧 欲 把 一 麾 江 海 去 乐 游 原 上 望 昭 陵,https://so.gushiwen.org/shiwenv_35d8561345a9.aspx
512,燕 子 来 时 新 社 梨 花 落 后 清 明 池 上 碧 苔 三 四 点 叶 底 黄 鹂 一 两 声 日 长 飞 絮 轻 巧 笑 东 邻 女 伴 采 桑 径 里 逢 迎 疑 怪 昨 宵 春 梦 好 元 是 今 朝 斗 草 赢 笑 从 双 脸 生,https://so.gushiwen.org/shiwenv_fc2335c98c2b.aspx
513,旅 馆 寒 灯 独 不 眠 客 心 何 事 转 凄 然 故 乡 今 夜 思 千 里 霜 鬓 明 朝 又 一 年,https://so.gushiwen.org/shiwenv_a34c2028f203.aspx
514,年 去 年 来 白 发 新 匆 匆 马 上 又 逢 春 关 河 底 事 空 留 客 岁 月 无 情 不 贷 人 一 寸 丹 心 图 报 国 两 行 清 泪 为 思 亲 孤 怀 激 烈 难 消 遣 漫 把 金 盘 簇 五 辛,https://so.gushiwen.org/shiwenv_ae6e8b720152.aspx
515,春 夜 阑 春 恨 切 花 外 子 规 啼 月 人 不 见 梦 难 凭 红 纱 一 点 灯 偏 怨 别 是 芳 节 庭 下 丁 香 千 结 宵 雾 散 晓 霞 晖 梁 间 双 燕 飞,https://so.gushiwen.org/shiwenv_403f9d7a471f.aspx
516,林 中 空 寂 舍 阶 下 终 南 山 高 卧 一 床 上 回 看 六 合 间 浮 云 几 处 灭 飞 鸟 何 时 还 问 义 天 人 接 无 心 世 界 闲 谁 知 大 隐 者 兄 弟 自 追 攀,https://so.gushiwen.org/shiwenv_a6480b5b533f.aspx
517,游 人 杜 陵 北 送 客 汉 川 东 无 论 去 与 住 俱 是 一 飘 蓬 秋 鬓 含 霜 白 衰 颜 倚 酒 红 别 有 相 思 处 啼 鸟 杂 夜 风,https://so.gushiwen.org/shiwenv_f9a4a3fa6796.aspx
518,双 鹅 飞 洛 阳 五 马 渡 江 徼 何 意 上 东 门 胡 雏 更 长 啸 中 原 走 豺 虎 烈 火 焚 宗 庙 太 白 昼 经 天 颓 阳 掩 馀 照 王 城 皆 荡 覆 世 路 成 奔 峭 四 海 望 长 安 颦 眉 寡 西 笑 苍 生 疑 落 叶 白 骨 空 相 吊 连 兵 似 雪 山 破 敌 谁 能 料 我 垂 北 溟 翼 且 学 南 山 豹 崔 子 贤 主 人 欢 娱 每 相 召 胡 床 紫 玉 笛 却 坐 青 云 叫 杨 花 满 州 城 置 酒 同 临 眺 忽 思 剡 溪 去 水 石 远 清 妙 雪 尽 天 地 明 风 开 湖 山 貌 闷 为 洛 生 咏 醉 发 吴 越 调 赤 霞 动 金 光 日 足 森 海 峤 独 散 万 古 意 闲 垂 一 溪 钓 猿 近 天 上 啼 人 移 月 边 棹 无 以 墨 绶 苦 来 求 丹 砂 要 华 发 长 折 腰 将 贻 陶 公 诮,https://so.gushiwen.org/shiwenv_0d19862e80a1.aspx
519,我 车 既 攻 我 马 既 同 四 牡 庞 庞 驾 言 徂 东 田 车 既 好 田 牡 孔 阜 东 有 甫 草 驾 言 行 狩 之 子 于 苗 选 徒 嚣 嚣 建 旐 设 旄 搏 兽 于 敖 驾 彼 四 牡 四 牡 奕 奕 赤 芾 金 舄 会 同 有 绎 决 拾 既 佽 弓 矢 既 调 射 夫 既 同 助 我 举 柴 四 黄 既 驾 两 骖 不 猗 不 失 其 驰 舍 矢 如 破 萧 萧 马 鸣 悠 悠 旆 旌 徒 御 不 惊 大 庖 不 盈 之 子 于 征 有 闻 无 声 允 矣 君 子 展 也 大 成,https://so.gushiwen.org/shiwenv_3c13a04420f3.aspx
520,一 尺 深 红 胜 曲 尘 天 生 旧 物 不 如 新 合 欢 桃 核 终 堪 恨 里 许 元 来 别 有 人 井 底 点 灯 深 烛 伊 共 郎 长 行 莫 围 棋 玲 珑 骰 子 安 红 豆 入 骨 相 思 知 不 知,https://so.gushiwen.org/shiwenv_a2b349dd32e8.aspx
521,岂 曰 无 衣 七 兮 不 如 子 之 衣 安 且 吉 兮 岂 曰 无 衣 六 兮 不 如 子 之 衣 安 且 燠 兮,https://so.gushiwen.org/shiwenv_ab10f29a0d36.aspx
522,匪 风 发 兮 匪 车 偈 兮 顾 瞻 周 道 中 心 怛 兮 匪 风 飘 兮 匪 车 嘌 兮 顾 瞻 周 道 中 心 吊 兮 谁 能 亨 鱼 溉 之 釜 鬵 谁 将 西 归 怀 之 好 音,https://so.gushiwen.org/shiwenv_ba56a6994882.aspx
523,越 王 勾 践 破 吴 归 义 士 还 乡 尽 锦 衣 宫 女 如 花 满 春 殿 只 今 惟 有 鹧 鸪 飞,https://so.gushiwen.org/shiwenv_bca625cc448c.aspx
524,楚 水 清 若 空 遥 将 碧 海 通 人 分 千 里 外 兴 在 一 杯 中 谷 鸟 吟 晴 日 江 猿 啸 晚 风 平 生 不 下 泪 于 此 泣 无 穷,https://so.gushiwen.org/shiwenv_abc1aa91e12a.aspx
525,永 夜 抛 人 何 处 去 绝 来 音 香 阁 掩 眉 敛 月 将 沉 争 忍 不 相 寻 怨 孤 衾 换 我 心 为 你 心 始 知 相 忆 深,https://so.gushiwen.org/shiwenv_cda0e25b4442.aspx
526,凉 叶 萧 萧 散 雨 声 虚 堂 淅 淅 掩 霜 清 黄 华 自 与 西 风 约 白 发 先 从 远 客 生 吟 似 候 虫 秋 更 苦 梦 和 寒 鹊 夜 频 惊 何 时 石 岭 关 山 路 一 望 家 山 眼 暂 明,https://so.gushiwen.org/shiwenv_b1348b9cef01.aspx
527,西 楼 遗 迹 尚 豪 雄 锦 绣 笙 萧 在 半 空 万 里 因 循 成 久 客 一 年 容 易 又 秋 风 烛 光 低 映 珠 鞴 丽 酒 晕 徐 添 玉 颊 红 归 路 迎 凉 更 堪 爱 摩 诃 池 上 月 方 中,https://so.gushiwen.org/shiwenv_29c6faf9a402.aspx
528,凭 绣 槛 解 罗 帷 未 得 君 书 断 肠 潇 湘 春 雁 飞 不 知 征 马 几 时 归 海 棠 花 谢 也 雨 霏 霏,https://so.gushiwen.org/shiwenv_df299cdcee7c.aspx
529,鸾 扇 斜 分 凤 幄 开 星 桥 横 过 鹊 飞 回 争 将 世 上 无 期 别 换 得 年 年 一 度 来,https://so.gushiwen.org/shiwenv_7c2f04422538.aspx
530,峭 壁 连 崆 峒 攒 峰 叠 翠 微 鸟 声 堪 驻 马 林 色 可 忘 机 怪 石 时 侵 径 轻 萝 乍 拂 衣 路 长 愁 作 客 年 老 更 思 归 且 悦 岩 峦 胜 宁 嗟 意 绪 违 山 行 应 未 尽 谁 与 玩 芳 菲,https://so.gushiwen.org/shiwenv_bd44b8f3604d.aspx
531,朝 来 临 镜 台 妆 罢 暂 裴 回 千 金 始 一 笑 一 召 讵 能 来,https://so.gushiwen.org/shiwenv_a26794930890.aspx
532,愁 脉 脉 目 断 江 南 江 北 烟 树 重 重 芳 信 隔 小 楼 山 几 尺 细 草 孤 云 斜 日 一 向 弄 晴 天 色 帘 外 落 花 飞 不 得 东 风 无 气 力,https://so.gushiwen.org/shiwenv_4f602ec5386b.aspx
533,秋 风 萧 萧 愁 杀 人 出 亦 愁 入 亦 愁 座 中 何 人 谁 不 怀 忧 令 我 白 头 胡 地 多 飚 风 树 木 何 修 修 离 家 日 趋 远 衣 带 日 趋 缓 心 思 不 能 言 肠 中 车 轮 转,https://so.gushiwen.org/shiwenv_db1436a0175e.aspx
534,信 彼 南 山 维 禹 甸 之 畇 畇 原 隰 曾 孙 田 之 我 疆 我 理 南 东 其 亩 上 天 同 云 雨 雪 雰 雰 益 之 以 霡 霂 既 优 既 渥 既 沾 既 足 生 我 百 谷 疆 埸 翼 翼 黍 稷 彧 彧 曾 孙 之 穑 以 为 酒 食 畀 我 尸 宾 寿 考 万 年 中 田 有 庐 疆 埸 有 瓜 是 剥 是 菹 献 之 皇 祖 曾 孙 寿 考 受 天 之 祜 祭 以 清 酒 从 以 骍 牡 享 于 祖 考 执 其 鸾 刀 以 启 其 毛 取 其 血 膋 是 烝 是 享 苾 苾 芬 芬 祀 事 孔 明 先 祖 是 皇 报 以 介 福 万 寿 无 疆,https://so.gushiwen.org/shiwenv_6c0808d66627.aspx
535,风 头 才 北 忽 成 南 转 眼 黄 田 到 谢 潭 仿 佛 一 峰 船 外 影 褰 帏 急 看 紫 巉 岩,https://so.gushiwen.org/shiwenv_9f34838d5cbd.aspx
536,偶 检 丛 纸 中 得 花 瓣 一 包 纸 背 细 书 辛 幼 安 更 能 消 几 番 风 雨 一 阕 乃 是 京 师 悯 忠 寺 海 棠 花 戊 辰 暮 春 所 戏 为 也 泫 然 得 句 人 天 无 据 被 侬 留 得 香 魂 住 如 梦 如 烟 枝 上 花 开 又 十 年 十 年 千 里 风 痕 雨 点 斓 斑 里 莫 怪 怜 他 身 世 依 然 是 落 花,https://so.gushiwen.org/shiwenv_64cc93b81c51.aspx
537,自 从 别 欢 后 叹 音 不 绝 响 黄 檗 向 春 生 苦 心 随 日 长,https://so.gushiwen.org/shiwenv_0a4e835673b6.aspx
