idx,poem_text,url
983,夹 道 开 洞 门 弱 柳 低 画 戟 帘 影 竹 华 起 萧 声 吹 日 色 蜂 语 绕 妆 镜 拂 蛾 学 春 碧 乱 系 丁 香 梢 满 栏 花 向 夕,https://so.gushiwen.org/shiwenv_7a5e00f3ed30.aspx
984,晴 川 落 日 初 低 惆 怅 孤 舟 解 携 鸟 向 平 芜 远 近 人 随 流 水 东 西 白 云 千 里 万 里 明 月 前 溪 后 溪 独 恨 长 沙 谪 去 江 潭 春 草 萋 萋,https://so.gushiwen.org/shiwenv_866f1f4dd299.aspx
985,羁 心 积 秋 晨 晨 积 展 游 眺 孤 客 伤 逝 湍 徒 旅 苦 奔 峭 石 浅 水 潺 湲 日 落 山 照 曜 荒 林 纷 沃 若 哀 禽 相 叫 啸 遭 物 悼 迁 斥 存 期 得 要 妙 既 秉 上 皇 心 岂 屑 末 代 诮 目 睹 严 子 濑 想 属 任 公 钓 谁 谓 古 今 殊 异 代 可 同 调,https://so.gushiwen.org/shiwenv_6a1bf5f75436.aspx
986,此 花 名 价 别 开 艳 益 皇 都 香 遍 苓 菱 死 红 烧 踯 躅 枯 软 光 笼 细 脉 妖 色 暖 鲜 肤 满 蕊 攒 黄 粉 含 棱 缕 绛 苏 好 和 薰 御 服 堪 画 入 宫 图 晚 态 愁 新 妇 残 妆 望 病 夫 教 人 知 个 数 留 客 赏 斯 须 一 夜 轻 风 起 千 金 买 亦 无,https://so.gushiwen.org/shiwenv_939a40bf3518.aspx
987,诗 人 安 得 有 青 衫 今 岁 和 戎 百 万 缣 从 此 西 湖 休 插 柳 剩 栽 桑 树 养 吴 蚕,https://so.gushiwen.org/shiwenv_f1ebab63332d.aspx
988,塔 势 如 涌 出 孤 高 耸 天 宫 登 临 出 世 界 蹬 道 盘 虚 空 突 兀 压 神 州 峥 嵘 如 鬼 工 四 角 碍 白 日 七 层 摩 苍 穹 下 窥 指 高 鸟 俯 听 闻 惊 风 连 山 若 波 涛 奔 走 似 朝 东 青 槐 夹 驰 道 宫 馆 何 玲 珑 秋 色 从 西 来 苍 然 满 关 中 五 陵 北 原 上 万 古 青 蒙 蒙 净 理 了 可 悟 胜 因 夙 所 宗 誓 将 挂 冠 去 觉 道 资 无 穷,https://so.gushiwen.org/shiwenv_b020bf234015.aspx
989,交 交 黄 鸟 止 于 棘 谁 从 穆 公 子 车 奄 息 维 此 奄 息 百 夫 之 特 临 其 穴 惴 惴 其 栗 彼 苍 者 天 歼 我 良 人 如 可 赎 兮 人 百 其 身 交 交 黄 鸟 止 于 桑 谁 从 穆 公 子 车 仲 行 维 此 仲 行 百 夫 之 防 临 其 穴 惴 惴 其 栗 彼 苍 者 天 歼 我 良 人 如 可 赎 兮 人 百 其 身 交 交 黄 鸟 止 于 楚 谁 从 穆 公 子 车 针 虎 维 此 针 虎 百 夫 之 御 临 其 穴 惴 惴 其 栗 彼 苍 者 天 歼 我 良 人 如 可 赎 兮 人 百 其 身,https://so.gushiwen.org/shiwenv_e344fb59fa53.aspx
990,投 簪 下 山 阁 携 酒 对 河 梁 陕 水 牵 长 镜 高 花 送 断 香 繁 莺 歌 似 曲 疏 蝶 舞 成 行 自 然 催 一 醉 非 但 阅 年 光,https://so.gushiwen.org/shiwenv_72071737da45.aspx
991,谁 道 闲 情 抛 掷 久 每 到 春 来 惆 怅 还 依 旧 日 日 花 前 常 病 酒 敢 辞 镜 里 朱 颜 瘦 河 畔 青 芜 堤 上 柳 为 问 新 愁 何 事 年 年 有 独 立 小 桥 风 满 袖 平 林 新 月 人 归 后,https://so.gushiwen.org/shiwenv_47b66dbb2f20.aspx
992,秦 时 明 月 汉 时 关 万 里 长 征 人 未 还 但 使 龙 城 飞 将 在 不 教 胡 马 度 阴 山 骝 马 新 跨 白 玉 鞍 战 罢 沙 场 月 色 寒 城 头 铁 鼓 声 犹 振 匣 里 金 刀 血 未 干,https://so.gushiwen.org/shiwenv_6e6d79655f69.aspx
993,献 岁 发 吾 将 行 春 山 茂 春 日 明 园 中 鸟 多 嘉 声 梅 始 发 柳 始 青 泛 舟 舻 齐 棹 惊 奏 采 菱 歌 鹿 鸣 风 微 起 波 微 生 弦 亦 发 酒 亦 倾 入 莲 池 折 桂 枝 芳 袖 动 芬 叶 披 两 相 思 两 不 知,https://so.gushiwen.org/shiwenv_977e8ae8ccda.aspx
994,条 山 苍 河 水 黄 浪 波 沄 沄 去 松 柏 在 山 冈,https://so.gushiwen.org/shiwenv_04d681265f6d.aspx
995,杨 柳 青 青 沟 水 流 莺 儿 调 舌 弄 娇 柔 桃 花 记 得 题 诗 客 斜 倚 春 风 笑 不 休,https://so.gushiwen.org/shiwenv_383d1fa138c2.aspx
996,只 眼 须 凭 自 主 张 纷 纷 艺 苑 漫 雌 黄 矮 人 看 戏 何 曾 见 都 是 随 人 说 短 长,https://so.gushiwen.org/shiwenv_f4096122e315.aspx
997,好 雨 当 春 要 趁 归 耕 况 而 今 已 是 清 明 小 窗 坐 地 侧 听 檐 声 恨 夜 来 风 夜 来 月 夜 来 云 花 絮 飘 零 莺 燕 丁 宁 怕 妨 侬 湖 上 闲 行 天 心 肯 後 费 甚 心 情 放 霎 时 阴 霎 时 雨 霎 时 晴,https://so.gushiwen.org/shiwenv_54f767d9ad71.aspx
998,江 盘 峡 束 春 湍 豪 雷 风 战 斗 鱼 龙 逃 悬 流 轰 轰 射 水 府 一 泻 百 里 翻 云 涛 漂 船 摆 石 万 瓦 裂 咫 尺 性 命 轻 鸿 毛,https://so.gushiwen.org/shiwenv_cb161252d8c3.aspx
999,蓝 桥 春 雪 君 归 日 秦 岭 秋 风 我 去 时 每 到 驿 亭 先 下 马 循 墙 绕 柱 觅 君 诗,https://so.gushiwen.org/shiwenv_7afb25f98c0d.aspx
1000,解 落 三 秋 叶 能 开 二 月 花 过 江 千 尺 浪 入 竹 万 竿 斜,https://so.gushiwen.org/shiwenv_8bc9e1cc2b8f.aspx
1001,到 处 陂 塘 决 决 流 垂 杨 百 里 罨 平 畴 行 人 便 觉 须 眉 绿 一 路 蝉 声 过 许 州,https://so.gushiwen.org/shiwenv_5816326dac9a.aspx
1002,大 江 阔 千 里 孤 舟 无 四 邻 唯 余 故 楼 月 远 近 必 随 人 入 风 先 绕 晕 排 雾 急 移 轮 若 教 长 似 扇 堪 拂 艳 歌 尘,https://so.gushiwen.org/shiwenv_7428d3e64866.aspx
1003,采 采 卷 耳 不 盈 顷 筐 嗟 我 怀 人 寘 彼 周 行 陟 彼 崔 嵬 我 马 虺 隤 我 姑 酌 彼 金 罍 维 以 不 永 怀 陟 彼 高 冈 我 马 玄 黄 我 姑 酌 彼 兕 觥 维 以 不 永 伤 陟 彼 砠 矣 我 马 瘏 矣 我 仆 痡 矣 云 何 吁 矣,https://so.gushiwen.org/shiwenv_63579de8b4d8.aspx
1004,风 雪 送 余 运 无 妨 时 已 和 梅 柳 夹 门 植 一 条 有 佳 花 我 唱 尔 言 得 酒 中 适 何 多 未 能 明 多 少 章 山 有 奇 歌,https://so.gushiwen.org/shiwenv_bd0f4cac6eee.aspx
1005,孤 儿 生 孤 子 遇 生 命 独 当 苦 父 母 在 时 乘 坚 车 驾 驷 马 父 母 已 去 兄 嫂 令 我 行 贾 南 到 九 江 东 到 齐 与 鲁 腊 月 来 归 不 敢 自 言 苦 头 多 虮 虱 面 目 多 尘 土 大 兄 言 办 饭 大 嫂 言 视 马 上 高 堂 行 取 殿 下 堂 孤 儿 泪 下 如 雨 使 我 朝 行 汲 暮 得 水 来 归 手 为 错 足 下 无 菲 怆 怆 履 霜 中 多 蒺 藜 拔 断 蒺 藜 肠 肉 中 怆 欲 悲 泪 下 渫 渫 清 涕 累 累 冬 无 复 襦 夏 无 单 衣 居 生 不 乐 不 如 早 去 下 从 地 下 黄 泉 春 气 动 草 萌 芽 三 月 蚕 桑 六 月 收 瓜 将 是 瓜 车 来 到 还 家 瓜 车 反 覆 助 我 者 少 啖 瓜 者 多 愿 还 我 蒂 兄 与 嫂 严 独 且 急 归 当 兴 校 计 乱 曰 里 中 一 何 譊 譊 愿 欲 寄 尺 书 将 与 地 下 父 母 兄 嫂 难 与 久 居,https://so.gushiwen.org/shiwenv_116e555b25c2.aspx
1006,青 青 园 中 葵 朝 露 待 日 晞 阳 春 布 德 泽 万 物 生 光 辉 常 恐 秋 节 至 焜 黄 华 叶 衰 百 川 东 到 海 何 时 复 西 归 少 壮 不 努 力 老 大 徒 伤 悲,https://so.gushiwen.org/shiwenv_183d69f50755.aspx
1007,南 山 有 台 北 山 有 莱 乐 只 君 子 邦 家 之 基 乐 只 君 子 万 寿 无 期 南 山 有 桑 北 山 有 杨 乐 只 君 子 邦 家 之 光 乐 只 君 子 万 寿 无 疆 南 山 有 杞 北 山 有 李 乐 只 君 子 民 之 父 母 乐 只 君 子 德 音 不 已 南 山 有 栲 北 山 有 杻 乐 只 君 子 遐 不 眉 寿 乐 只 君 子 德 音 是 茂 南 山 有 枸 北 山 有 楰 乐 只 君 子 遐 不 黄 耇 乐 只 君 子 保 艾 尔 后,https://so.gushiwen.org/shiwenv_1c43f22c5ed3.aspx
1008,巫 山 高 高 以 大 淮 水 深 难 以 逝 我 欲 东 归 害 梁 不 为 我 集 无 高 曳 水 何 梁 汤 汤 回 回 临 水 远 望 泣 下 沾 衣 远 道 之 人 心 思 归 谓 之 何,https://so.gushiwen.org/shiwenv_7b668ccac430.aspx
1009,自 从 别 京 华 我 心 乃 萧 索 十 年 守 章 句 万 事 空 寥 落 北 上 登 蓟 门 茫 茫 见 沙 漠 倚 剑 对 风 尘 慨 然 思 卫 霍 拂 衣 去 燕 赵 驱 马 怅 不 乐 天 长 沧 州 路 日 暮 邯 郸 郭 酒 肆 或 淹 留 渔 潭 屡 栖 泊 独 行 备 艰 险 所 见 穷 善 恶 永 愿 拯 刍 荛 孰 云 干 鼎 镬 皇 情 念 淳 古 时 俗 何 浮 薄 理 道 资 任 贤 安 人 在 求 瘼 故 交 负 灵 奇 逸 气 抱 謇 谔 隐 轸 经 济 具 纵 横 建 安 作 才 望 忽 先 鸣 风 期 无 宿 诺 飘 摇 劳 州 县 迢 递 限 言 谑 东 驰 眇 贝 丘 西 顾 弥 虢 略 淇 水 徒 自 流 浮 云 不 堪 讬 吾 谋 适 可 用 天 路 岂 寥 廓 不 然 买 山 田 一 身 与 耕 凿 且 欲 同 鹪 鹩 焉 能 志 鸿 鹤,https://so.gushiwen.org/shiwenv_b02c50d0cadb.aspx
1010,青 门 金 锁 平 旦 开 城 头 日 出 使 车 回 青 门 柳 枝 正 堪 折 路 傍 一 日 几 人 别 东 出 青 门 路 不 穷 驿 楼 官 树 灞 陵 东 花 扑 征 衣 看 似 绣 云 随 去 马 色 疑 骢 胡 姬 酒 垆 日 未 午 丝 绳 玉 缸 酒 如 乳 灞 头 落 花 没 马 蹄 昨 夜 微 雨 花 成 泥 黄 鹂 翅 湿 飞 转 低 关 东 尺 书 醉 懒 题 须 臾 望 君 不 可 见 扬 鞭 飞 鞚 疾 如 箭 借 问 使 乎 何 时 来 莫 作 东 飞 伯 劳 西 飞 燕,https://so.gushiwen.org/shiwenv_18ea8e36a080.aspx
1011,十 里 长 街 市 井 连 月 明 桥 上 看 神 仙 人 生 只 合 扬 州 死 禅 智 山 光 好 墓 田,https://so.gushiwen.org/shiwenv_5083e559b93c.aspx
1012,秋 江 渺 渺 芙 蓉 芳 秋 江 女 儿 将 断 肠 绛 袍 春 浅 护 云 暖 翠 袖 日 暮 迎 风 凉 鲤 鱼 吹 浪 江 波 白 霜 落 洞 庭 飞 木 叶 荡 舟 何 处 采 莲 人 爱 惜 芙 蓉 好 颜 色,https://so.gushiwen.org/shiwenv_050f8f327f76.aspx
1013,薤 上 露 何 易 晞 露 晞 明 朝 更 复 落 人 死 一 去 何 时 归,https://so.gushiwen.org/shiwenv_8a34d5a78abc.aspx
1014,金 风 荡 初 节 玉 露 凋 晚 林 此 夕 穷 涂 士 郁 陶 伤 寸 心 野 平 葭 苇 合 村 荒 藜 藿 深 眺 听 良 多 感 徙 倚 独 沾 襟 沾 襟 何 所 为 怅 然 怀 古 意 秦 俗 犹 未 平 汉 道 将 何 冀 樊 哙 市 井 徒 萧 何 刀 笔 吏 一 朝 时 运 会 千 古 传 名 谥 寄 言 世 上 雄 虚 生 真 可 愧,https://so.gushiwen.org/shiwenv_6853390aa214.aspx
1015,胡 风 吹 代 马 北 拥 鲁 阳 关 吴 兵 照 海 雪 西 讨 何 时 还 半 渡 上 辽 津 黄 云 惨 无 颜 老 母 与 子 别 呼 天 野 草 间 白 马 绕 旌 旗 悲 鸣 相 追 攀 白 杨 秋 月 苦 早 落 豫 章 山 本 为 休 明 人 斩 虏 素 不 闲 岂 惜 战 斗 死 为 君 扫 凶 顽 精 感 石 没 羽 岂 云 惮 险 艰 楼 船 若 鲸 飞 波 荡 落 星 湾 此 曲 不 可 奏 三 军 鬓 成 斑,https://so.gushiwen.org/shiwenv_461e9fee0f0d.aspx
1016,扬 舲 万 里 笑 当 年 底 事 中 分 南 北 须 信 平 生 无 梦 到 却 向 而 今 游 历 老 柳 官 河 斜 阳 古 道 风 定 波 犹 直 野 人 惊 问 泛 槎 何 处 狂 客 迎 面 落 叶 萧 萧 水 流 沙 共 远 都 无 行 迹 衰 草 凄 迷 秋 更 绿 唯 有 闲 鸥 独 立 浪 挟 天 浮 山 邀 云 去 银 浦 横 空 碧 扣 舷 歌 断 海 蟾 飞 上 孤 白,https://so.gushiwen.org/shiwenv_dbec80a3444c.aspx
1017,春 日 在 天 涯 天 涯 日 又 斜 莺 啼 如 有 泪 为 湿 最 高 花,https://so.gushiwen.org/shiwenv_a5b8eb647c8f.aspx
1018,弹 铗 西 来 路 记 匆 匆 经 行 十 日 几 番 风 雨 梦 里 寻 秋 秋 不 见 秋 在 平 芜 远 树 雁 信 落 家 山 何 处 万 里 西 风 吹 客 鬓 把 菱 花 自 笑 人 如 许 留 不 住 少 年 去 男 儿 事 业 无 凭 据 记 当 年 悲 歌 击 楫 酒 酣 箕 踞 腰 下 光 芒 三 尺 剑 时 解 挑 灯 夜 语 谁 更 识 此 时 情 绪 唤 起 杜 陵 风 月 手 写 江 东 渭 北 相 思 句 歌 此 恨 慰 羁 旅,https://so.gushiwen.org/shiwenv_7bfdc21c81c5.aspx
1019,泛 彼 柏 舟 在 彼 中 河 髧 彼 两 髦 实 维 我 仪 之 死 矢 靡 它 母 也 天 只 不 谅 人 只 泛 彼 柏 舟 在 彼 河 侧 髧 彼 两 髦 实 维 我 特 之 死 矢 靡 慝 母 也 天 只 不 谅 人 只,https://so.gushiwen.org/shiwenv_4690e75454c9.aspx
1020,凤 髻 蟠 空 袅 娜 腰 肢 温 更 柔 轻 移 莲 步 汉 宫 飞 燕 旧 风 流 谩 催 鼍 鼓 品 梁 州 鹧 鸪 飞 起 春 罗 袖 锦 缠 头 刘 郎 错 认 风 前 柳,https://so.gushiwen.org/shiwenv_74d972ef73f5.aspx
1021,落 羽 辞 金 殿 孤 鸣 咤 绣 衣 能 言 终 见 弃 还 向 陇 西 飞,https://so.gushiwen.org/shiwenv_7dfd948f378c.aspx
1022,陟 彼 岵 兮 瞻 望 父 兮 父 曰 嗟 予 子 行 役 夙 夜 无 已 上 慎 旃 哉 犹 来 无 止 陟 彼 屺 兮 瞻 望 母 兮 母 曰 嗟 予 季 行 役 夙 夜 无 寐 上 慎 旃 哉 犹 来 无 弃 陟 彼 冈 兮 瞻 望 兄 兮 兄 曰 嗟 予 弟 行 役 夙 夜 必 偕 上 慎 旃 哉 犹 来 无 死,https://so.gushiwen.org/shiwenv_6ed686e89556.aspx
1023,城 窄 山 将 压 江 宽 地 共 浮 东 南 通 绝 域 西 北 有 高 楼 神 护 青 枫 岸 龙 移 白 石 湫 殊 乡 竟 何 祷 箫 鼓 不 曾 休,https://so.gushiwen.org/shiwenv_4ff21f7fb675.aspx
1024,两 地 俱 秋 夕 相 望 共 星 河 高 梧 一 叶 下 空 斋 归 思 多 方 用 忧 人 瘼 况 自 抱 微 痾 无 将 别 来 近 颜 鬓 已 蹉 跎,https://so.gushiwen.org/shiwenv_404702e9bff5.aspx
1025,雨 晴 云 散 满 江 明 月 风 微 浪 息 扁 舟 一 叶 半 夜 心 三 生 梦 万 里 别 闷 倚 篷 窗 睡 些,https://so.gushiwen.org/shiwenv_a58fc3fffd54.aspx
1026,一 条 寒 玉 走 秋 泉 引 出 深 萝 洞 口 烟 十 里 暗 流 声 不 断 行 人 头 上 过 潺 湲,https://so.gushiwen.org/shiwenv_cfc87e4bb96a.aspx
1027,苍 莽 寒 空 远 色 愁 呜 呜 戍 角 上 高 楼 吴 姬 怨 思 吹 双 管 燕 客 悲 歌 别 五 侯 千 里 关 山 边 草 暮 一 星 烽 火 朔 云 秋 夜 来 霜 重 西 风 起 陇 水 无 声 冻 不 流,https://so.gushiwen.org/shiwenv_c05f8d475405.aspx
1028,玉 垒 高 桐 拂 玉 绳 上 含 非 雾 下 含 冰 枉 教 紫 凤 无 栖 处 斫 作 秋 琴 弹 坏 陵,https://so.gushiwen.org/shiwenv_fe45491ba0df.aspx
1029,杨 花 扑 帐 春 云 热 龟 甲 屏 风 醉 眼 缬 东 家 胡 蝶 西 家 飞 白 骑 少 年 今 日 归,https://so.gushiwen.org/shiwenv_f131fc393466.aspx
1030,酒 旗 相 望 大 堤 头 堤 下 连 樯 堤 上 楼 日 暮 行 人 争 渡 急 桨 声 幽 轧 满 中 流 江 南 江 北 望 烟 波 入 夜 行 人 相 应 歌 桃 叶 传 情 竹 枝 怨 水 流 无 限 月 明 多 长 堤 缭 绕 水 徘 徊 酒 舍 旗 亭 次 第 开 日 晚 出 帘 招 估 客 轲 峨 大 艑 落 帆 来,https://so.gushiwen.org/shiwenv_18e49b00b83d.aspx
1031,十 岁 裁 诗 走 马 成 冷 灰 残 烛 动 离 情 桐 花 万 里 丹 山 路 雏 凤 清 于 老 凤 声 剑 栈 风 樯 各 苦 辛 别 时 冰 雪 到 时 春 为 凭 何 逊 休 联 句 瘦 尽 东 阳 姓 沈 人,https://so.gushiwen.org/shiwenv_f0a35d1fe490.aspx
1032,饯 税 巽 甫 唐 入 以 处 士 辟 幕 府 如 石 温 辈 甚 多 税 君 巽 甫 以 命 士 来 淮 幕 三 年 矣 略 不 能 挽 之 以 寸 巽 甫 号 安 之 如 某 歉 何 临 别 赋 沁 园 春 以 饯 水 北 洛 南 未 尝 无 人 不 同 者 时 赖 交 情 兰 臭 绸 缪 相 好 宦 情 云 薄 得 失 何 知 夜 观 论 兵 春 原 吊 古 慷 慨 事 功 千 载 期 萧 如 也 料 行 囊 如 水 只 有 新 诗 归 兮 归 去 来 兮 我 亦 办 征 帆 非 晚 归 正 姑 苏 台 畔 米 廉 酒 好 吴 松 江 上 莼 嫩 鱼 肥 我 住 孤 村 相 连 一 水 载 月 不 妨 时 过 之 长 亭 路 又 何 须 回 首 折 柳 依 依,https://so.gushiwen.org/shiwenv_4edda423d25f.aspx
1033,南 都 信 佳 丽 武 阙 横 西 关 白 水 真 人 居 万 商 罗 鄽 闤 高 楼 对 紫 陌 甲 第 连 青 山 此 地 多 英 豪 邈 然 不 可 攀 陶 朱 与 五 羖 名 播 天 壤 间 丽 华 秀 玉 色 汉 女 娇 朱 颜 清 歌 遏 流 云 艳 舞 有 馀 闲 遨 游 盛 宛 洛 冠 盖 随 风 还 走 马 红 阳 城 呼 鹰 白 河 湾 谁 识 卧 龙 客 长 吟 愁 鬓 斑,https://so.gushiwen.org/shiwenv_341d3ce89cdf.aspx
1034,竹 里 风 生 月 上 门 理 秦 筝 对 云 屏 轻 拨 朱 弦 恐 乱 马 嘶 声 含 恨 含 娇 独 自 语 今 夜 约 太 迟 生,https://so.gushiwen.org/shiwenv_b2251553f81d.aspx
1035,天 地 间 人 为 贵 立 君 牧 民 为 之 轨 则 车 辙 马 迹 经 纬 四 极 黜 陟 幽 明 黎 庶 繁 息 於 铄 贤 圣 总 统 邦 域 封 建 五 爵 井 田 刑 狱 有 燔 丹 书 无 普 赦 赎 皋 陶 甫 侯 何 有 失 职 嗟 哉 后 世 改 制 易 律 劳 民 为 君 役 赋 其 力 舜 漆 食 器 畔 者 十 国 不 及 唐 尧 采 椽 不 斫 世 叹 伯 夷 欲 以 厉 俗 侈 恶 之 大 俭 为 共 德 许 由 推 让 岂 有 讼 曲 兼 爱 尚 同 疏 者 为 戚,https://so.gushiwen.org/shiwenv_45f72750e38d.aspx
1036,南 浦 凄 凄 别 西 风 袅 袅 秋 一 看 肠 一 断 好 去 莫 回 头,https://so.gushiwen.org/shiwenv_434c0f9ea3ff.aspx
1037,今 年 游 寓 独 游 秦 愁 思 看 春 不 当 春 上 林 苑 里 花 徒 发 细 柳 营 前 叶 漫 新 公 子 南 桥 应 尽 兴 将 军 西 第 几 留 宾 寄 语 洛 城 风 日 道 明 年 春 色 倍 还 人,https://so.gushiwen.org/shiwenv_eeaf15edc8be.aspx
1038,北 风 其 凉 雨 雪 其 雱 惠 而 好 我 携 手 同 行 其 虚 其 邪 既 亟 只 且 北 风 其 喈 雨 雪 其 霏 惠 而 好 我 携 手 同 归 其 虚 其 邪 既 亟 只 且 莫 赤 匪 狐 莫 黑 匪 乌 惠 而 好 我 携 手 同 车 其 虚 其 邪 既 亟 只 且,https://so.gushiwen.org/shiwenv_cafcc3b10cbc.aspx
1039,红 日 已 高 三 丈 透 金 炉 次 第 添 香 兽 红 锦 地 衣 随 步 皱 佳 人 舞 点 金 钗 溜 酒 恶 时 拈 花 蕊 嗅 别 殿 遥 闻 箫 鼓 奏,https://so.gushiwen.org/shiwenv_660642af8e3f.aspx
1040,袅 袅 沉 水 烟 乌 啼 夜 阑 景 曲 沼 芙 蓉 波 腰 围 白 玉 冷,https://so.gushiwen.org/shiwenv_82899e5b9deb.aspx
1041,荆 蛮 非 我 乡 何 为 久 滞 淫 方 舟 泝 大 江 日 暮 愁 我 心 山 冈 有 余 映 岩 阿 增 重 阴 狐 狸 驰 赴 穴 飞 鸟 翔 故 林 流 波 激 清 响 猴 猿 临 岸 吟 迅 风 拂 裳 袂 白 露 沾 衣 襟 独 夜 不 能 寐 摄 衣 起 抚 琴 丝 桐 感 人 情 为 我 发 悲 音 羁 旅 无 终 极 忧 思 壮 难 任,https://so.gushiwen.org/shiwenv_c9471ec28839.aspx
1042,对 案 不 能 食 拔 剑 击 柱 长 叹 息 丈 夫 生 世 会 几 时 安 能 蹀 躞 垂 羽 翼 弃 置 罢 官 去 还 家 自 休 息 朝 出 与 亲 辞 暮 还 在 亲 侧 弄 儿 床 前 戏 看 妇 机 中 织 自 古 圣 贤 尽 贫 贱 何 况 我 辈 孤 且 直,https://so.gushiwen.org/shiwenv_62aea44ba9a1.aspx
1043,关 东 有 义 士 兴 兵 讨 群 凶 初 期 会 盟 津 乃 心 在 咸 阳 军 合 力 不 齐 踌 躇 而 雁 行 势 利 使 人 争 嗣 还 自 相 戕 淮 南 弟 称 号 刻 玺 于 北 方 铠 甲 生 虮 虱 万 姓 以 死 亡 白 骨 露 于 野 千 里 无 鸡 鸣 生 民 百 遗 一 念 之 断 人 肠,https://so.gushiwen.org/shiwenv_0c29e174924a.aspx
1044,江 草 日 日 唤 愁 生 巫 峡 泠 泠 非 世 情 盘 涡 鹭 浴 底 心 性 独 树 花 发 自 分 明 十 年 戎 马 暗 万 国 异 域 宾 客 老 孤 城 渭 水 秦 山 得 见 否 人 今 罢 病 虎 纵 横,https://so.gushiwen.org/shiwenv_d7aee85167aa.aspx
1045,西 风 信 来 家 万 里 问 我 归 期 未 雁 啼 红 叶 天 人 醉 黄 花 地 芭 蕉 雨 声 秋 梦 里,https://so.gushiwen.org/shiwenv_a2557aca186c.aspx
1046,高 馆 张 灯 酒 复 清 夜 钟 残 月 雁 归 声 只 言 啼 鸟 堪 求 侣 无 那 春 风 欲 送 行 黄 河 曲 里 沙 为 岸 白 马 津 边 柳 向 城 莫 怨 他 乡 暂 离 别 知 君 到 处 有 逢 迎,https://so.gushiwen.org/shiwenv_06e47f4df463.aspx
1047,天 上 月 遥 望 似 一 团 银 夜 久 更 阑 风 渐 紧 与 奴 吹 散 月 边 云 照 见 负 心 人,https://so.gushiwen.org/shiwenv_c80d7a366514.aspx
1048,海 客 谈 瀛 洲 烟 涛 微 茫 信 难 求 越 人 语 天 姥 云 霞 明 灭 或 可 睹 天 姥 连 天 向 天 横 势 拔 五 岳 掩 赤 城 天 台 四 万 八 千 丈 对 此 欲 倒 东 南 倾 我 欲 因 之 梦 吴 越 一 夜 飞 度 镜 湖 月 湖 月 照 我 影 送 我 至 剡 溪 谢 公 宿 处 今 尚 在 渌 水 荡 漾 清 猿 啼 脚 著 谢 公 屐 身 登 青 云 梯 半 壁 见 海 日 空 中 闻 天 鸡 千 岩 万 转 路 不 定 迷 花 倚 石 忽 已 暝 熊 咆 龙 吟 殷 岩 泉 栗 深 林 兮 惊 层 巅 云 青 青 兮 欲 雨 水 澹 澹 兮 生 烟 列 缺 霹 雳 丘 峦 崩 摧 洞 天 石 扉 訇 然 中 开 青 冥 浩 荡 不 见 底 日 月 照 耀 金 银 台 霓 为 衣 兮 风 为 马 云 之 君 兮 纷 纷 而 来 下 虎 鼓 瑟 兮 鸾 回 车 仙 之 人 兮 列 如 麻 忽 魂 悸 以 魄 动 恍 惊 起 而 长 嗟 惟 觉 时 之 枕 席 失 向 来 之 烟 霞 世 间 行 乐 亦 如 此 古 来 万 事 东 流 水 别 君 去 兮 何 时 还 且 放 白 鹿 青 崖 间 须 行 即 骑 访 名 山 安 能 摧 眉 折 腰 事 权 贵 使 我 不 得 开 心 颜,https://so.gushiwen.org/shiwenv_05e2f6fc757c.aspx
1049,主 人 且 勿 喧 贱 子 歌 一 言 仆 本 寒 乡 士 出 身 蒙 汉 恩 始 随 张 校 尉 召 募 到 河 源 后 逐 李 轻 车 追 虏 出 塞 垣 密 途 亘 万 里 宁 岁 犹 七 奔 肌 力 尽 鞍 甲 心 思 历 凉 温 将 军 既 下 世 部 曲 亦 罕 存 时 事 一 朝 异 孤 绩 谁 复 论 少 壮 辞 家 去 穷 老 还 入 门 腰 镰 刈 葵 藿 倚 杖 牧 鸡 豚 昔 如 鞲 上 鹰 今 似 槛 中 猿 徒 结 千 载 恨 空 负 百 年 怨 弃 席 思 君 幄 疲 马 恋 君 轩 愿 垂 晋 主 惠 不 愧 田 子 魂,https://so.gushiwen.org/shiwenv_9c506f117711.aspx
1050,占 得 佳 名 绕 树 芳 依 依 相 伴 向 秋 光 若 教 此 物 堪 收 贮 应 被 豪 门 尽 劚 将,https://so.gushiwen.org/shiwenv_c0bf4dfbdcd2.aspx
1051,青 山 相 待 白 云 相 爱 梦 不 到 紫 罗 袍 共 黄 金 带 一 茅 斋 野 花 开 管 甚 谁 家 兴 废 谁 成 败 陋 巷 箪 瓢 亦 乐 哉 贫 气 不 改 达 志 不 改,https://so.gushiwen.org/shiwenv_f2b584c08107.aspx
1052,扑 蕊 添 黄 子 呵 花 满 翠 鬟 鸳 枕 映 屏 山 月 明 三 五 夜 对 芳 颜,https://so.gushiwen.org/shiwenv_22613d5c6654.aspx
1053,息 徒 兰 圃 秣 马 华 山 流 磻 平 皋 垂 纶 长 川 目 送 归 鸿 手 挥 五 弦 俯 仰 自 得 游 心 太 玄 嘉 彼 钓 叟 得 鱼 忘 筌 郢 人 逝 矣 谁 与 尽 言,https://so.gushiwen.org/shiwenv_3dfd964acf90.aspx
1054,前 舟 已 眇 眇 欲 渡 谁 相 待 秋 山 起 暮 钟 楚 雨 连 沧 海 风 波 离 思 满 宿 昔 容 鬓 改 独 鸟 下 东 南 广 陵 何 处 在,https://so.gushiwen.org/shiwenv_b185acaa3ac2.aspx
1055,此 恨 何 时 已 滴 空 阶 寒 更 雨 歇 葬 花 天 气 三 载 悠 悠 魂 梦 杳 是 梦 久 应 醒 矣 料 也 觉 人 间 无 味 不 及 夜 台 尘 土 隔 冷 清 清 一 片 埋 愁 地 钗 钿 约 竟 抛 弃 重 泉 若 有 双 鱼 寄 好 知 他 年 来 苦 乐 与 谁 相 倚 我 自 中 宵 成 转 侧 忍 听 湘 弦 重 理 待 结 个 他 生 知 已 还 怕 两 人 俱 薄 命 再 缘 悭 剩 月 零 风 里 清 泪 尽 纸 灰 起,https://so.gushiwen.org/shiwenv_459a494177cb.aspx
1056,梅 子 留 酸 软 齿 牙 芭 蕉 分 绿 与 窗 纱 日 长 睡 起 无 情 思 闲 看 儿 童 捉 柳 花,https://so.gushiwen.org/shiwenv_a55ac6fe8a38.aspx
1057,停 杯 不 举 停 歌 不 发 等 候 银 蟾 出 海 不 知 何 处 片 云 来 做 许 大 通 天 障 碍 髯 虬 捻 断 星 眸 睁 裂 唯 恨 剑 锋 不 快 一 挥 截 断 紫 云 腰 仔 细 看 嫦 娥 体 态,https://so.gushiwen.org/shiwenv_356fa6e4c077.aspx
1058,悲 歌 可 以 当 泣 远 望 可 以 当 归 思 念 故 乡 郁 郁 累 累 欲 归 家 无 人 欲 渡 河 无 船 心 思 不 能 言 肠 中 车 轮 转,https://so.gushiwen.org/shiwenv_a9d727eecf26.aspx
1059,西 北 有 高 楼 上 与 浮 云 齐 交 疏 结 绮 窗 阿 阁 三 重 阶 上 有 弦 歌 声 音 响 一 何 悲 谁 能 为 此 曲 无 乃 杞 梁 妻 清 商 随 风 发 中 曲 正 徘 徊 一 弹 再 三 叹 慷 慨 有 余 哀 不 惜 歌 者 苦 但 伤 知 音 稀 愿 为 双 鸿 鹄 奋 翅 起 高 飞,https://so.gushiwen.org/shiwenv_97ba2b134232.aspx
1060,猿 愁 鱼 踊 水 翻 波 自 古 流 传 是 汨 罗 蘋 藻 满 盘 无 处 奠 空 闻 渔 父 扣 舷 歌,https://so.gushiwen.org/shiwenv_a0fcf92413cd.aspx
1061,忆 对 中 秋 丹 桂 丛 花 也 杯 中 月 也 杯 中 今 宵 楼 上 一 尊 同 云 湿 纱 窗 雨 湿 纱 窗 浑 欲 乘 风 问 化 工 路 也 难 通 信 也 难 通 满 堂 唯 有 烛 花 红 歌 且 从 容 杯 且 从 容,https://so.gushiwen.org/shiwenv_948b883e012a.aspx
1062,少 无 适 俗 韵 性 本 爱 丘 山 误 落 尘 网 中 一 去 三 十 年 羁 鸟 恋 旧 林 池 鱼 思 故 渊 开 荒 南 野 际 守 拙 归 园 田 方 宅 十 余 亩 草 屋 八 九 间 榆 柳 荫 后 檐 桃 李 罗 堂 前 暧 暧 远 人 村 依 依 墟 里 烟 狗 吠 深 巷 中 鸡 鸣 桑 树 颠 户 庭 无 尘 杂 虚 室 有 余 闲 久 在 樊 笼 里 复 得 返 自 然,https://so.gushiwen.org/shiwenv_a537ff195683.aspx
1063,馆 娃 宫 外 邺 城 西 远 映 征 帆 近 拂 堤 系 得 王 孙 归 意 切 不 关 芳 草 绿 萋 萋,https://so.gushiwen.org/shiwenv_8bbea80d5de5.aspx
1064,彼 黍 离 离 彼 稷 之 苗 行 迈 靡 靡 中 心 摇 摇 知 我 者 谓 我 心 忧 不 知 我 者 谓 我 何 求 悠 悠 苍 天 此 何 人 哉 彼 黍 离 离 彼 稷 之 穗 行 迈 靡 靡 中 心 如 醉 知 我 者 谓 我 心 忧 不 知 我 者 谓 我 何 求 悠 悠 苍 天 此 何 人 哉 彼 黍 离 离 彼 稷 之 实 行 迈 靡 靡 中 心 如 噎 知 我 者 谓 我 心 忧 不 知 我 者 谓 我 何 求 悠 悠 苍 天 此 何 人 哉,https://so.gushiwen.org/shiwenv_2f3e1e0a34bb.aspx
