idx,poem_text,url
1460,失 我 焉 支 山 令 我 妇 女 无 颜 色 失 我 祁 连 山 使 我 六 畜 不 蕃 息,https://so.gushiwen.org/shiwenv_7454690ac42c.aspx
1461,春 日 宴 绿 酒 一 杯 歌 一 遍 再 拜 陈 三 愿 一 愿 郎 君 千 岁 二 愿 妾 身 常 健 三 愿 如 同 梁 上 燕 岁 岁 长 相 见,https://so.gushiwen.org/shiwenv_f4af51f1f7ef.aspx
1462,孟 冬 寒 气 至 北 风 何 惨 栗 愁 多 知 夜 长 仰 观 众 星 列 三 五 明 月 满 四 五 蟾 兔 缺 客 从 远 方 来 遗 我 一 书 札 上 言 长 相 思 下 言 久 离 别 置 书 怀 袖 中 三 岁 字 不 灭 一 心 抱 区 区 惧 君 不 识 察,https://so.gushiwen.org/shiwenv_2c7d1e6ffc71.aspx
1463,金 井 梧 桐 秋 叶 黄 珠 帘 不 卷 夜 来 霜 熏 笼 玉 枕 无 颜 色 卧 听 南 宫 清 漏 长 高 殿 秋 砧 响 夜 阑 霜 深 犹 忆 御 衣 寒 银 灯 青 琐 裁 缝 歇 还 向 金 城 明 主 看 奉 帚 平 明 金 殿 开 暂 将 团 扇 共 徘 徊 玉 颜 不 及 寒 鸦 色 犹 带 昭 阳 日 影 来 真 成 薄 命 久 寻 思 梦 见 君 王 觉 后 疑 火 照 西 宫 知 夜 饮 分 明 复 道 奉 恩 时 长 信 宫 中 秋 月 明 昭 阳 殿 下 捣 衣 声 白 露 堂 中 细 草 迹 红 罗 帐 里 不 胜 情,https://so.gushiwen.org/shiwenv_a17757fab9fb.aspx
1464,故 园 三 径 吐 幽 丛 一 夜 玄 霜 坠 碧 空 多 少 天 涯 未 归 客 尽 借 篱 落 看 秋 风,https://so.gushiwen.org/shiwenv_193b0dfc0815.aspx
1465,接 战 春 来 苦 孤 城 日 渐 危 合 围 侔 月 晕 分 守 若 鱼 丽 屡 厌 黄 尘 起 时 将 白 羽 挥 裹 疮 犹 出 阵 饮 血 更 登 陴 忠 信 应 难 敌 坚 贞 谅 不 移 无 人 报 天 子 心 计 欲 何 施,https://so.gushiwen.org/shiwenv_206aa6bb4e6c.aspx
1466,今 日 天 气 佳 清 吹 与 鸣 弹 感 彼 柏 下 人 安 得 不 为 欢 清 歌 散 新 声 绿 酒 开 芳 颜 未 知 明 日 事 余 襟 良 以 殚,https://so.gushiwen.org/shiwenv_2107069fb45b.aspx
1467,昨 夜 霜 风 先 入 梧 桐 浑 无 处 回 避 衰 容 问 公 何 事 不 语 书 空 但 一 回 醉 一 回 病 一 回 慵 朝 来 庭 下 光 阴 如 箭 似 无 言 有 意 伤 侬 都 将 万 事 付 与 千 钟 任 酒 花 白 眼 花 乱 烛 花 红,https://so.gushiwen.org/shiwenv_b635c877b2ae.aspx
1468,白 头 波 上 白 头 翁 家 逐 船 移 浦 浦 风 一 尺 鲈 鱼 新 钓 得 儿 孙 吹 火 荻 花 中,https://so.gushiwen.org/shiwenv_3cbd1579f778.aspx
1469,山 势 如 龙 去 复 回 闲 云 野 望 护 重 台 离 宫 夜 有 月 高 下 辇 路 日 无 人 往 来 春 色 不 随 亡 国 尽 野 花 只 作 旧 时 开 断 碑 衰 草 荒 烟 里 风 雨 年 年 上 绿 苔,https://so.gushiwen.org/shiwenv_303e777886e7.aspx
1470,北 上 太 行 山 艰 哉 何 巍 巍 羊 肠 坂 诘 屈 车 轮 为 之 摧 树 木 何 萧 瑟 北 风 声 正 悲 熊 罴 对 我 蹲 虎 豹 夹 路 啼 溪 谷 少 人 民 雪 落 何 霏 霏 延 颈 长 叹 息 远 行 多 所 怀 我 心 何 怫 郁 思 欲 一 东 归 水 深 桥 梁 绝 中 路 正 徘 徊 迷 惑 失 故 路 薄 暮 无 宿 栖 行 行 日 已 远 人 马 同 时 饥 担 囊 行 取 薪 斧 冰 持 作 糜 悲 彼 东 山 诗 悠 悠 使 我 哀,https://so.gushiwen.org/shiwenv_692ed5d1448d.aspx
1471,燕 子 不 曾 来 小 院 阴 阴 雨 一 角 阑 干 聚 落 花 此 是 春 归 处 弹 泪 别 东 风 把 酒 浇 飞 絮 化 了 浮 萍 也 是 愁 莫 向 天 涯 去,https://so.gushiwen.org/shiwenv_172626c4b400.aspx
1472,宜 春 苑 外 最 长 条 闲 袅 春 风 伴 舞 腰 正 是 玉 人 肠 绝 处 一 渠 春 水 赤 栏 桥,https://so.gushiwen.org/shiwenv_964fb044dc8d.aspx
1473,堂 堂 大 元 奸 佞 专 权 开 河 变 钞 祸 根 源 惹 红 巾 万 千 官 法 滥 刑 法 重 黎 民 怨 人 吃 人 钞 买 钞 何 曾 见 贼 做 官 官 做 贼 混 贤 愚 哀 哉 可 怜,https://so.gushiwen.org/shiwenv_8c0575ea601b.aspx
1474,黄 口 为 人 罗 白 龙 乃 鱼 服 得 罪 岂 怨 天 以 愚 陷 网 目 鲸 鲵 未 翦 灭 豺 狼 屡 翻 履 悲 作 楚 地 囚 何 日 秦 庭 哭 遭 逢 二 明 主 前 后 两 迁 逐 去 国 愁 夜 郎 投 身 窜 荒 谷 半 道 雪 屯 蒙 旷 如 鸟 出 笼 遥 欣 克 复 美 光 武 安 可 同 天 子 巡 剑 阁 储 皇 守 扶 风 扬 袂 正 北 辰 开 襟 揽 群 雄 胡 兵 出 月 窟 雷 破 关 之 东 左 扫 因 右 拂 旋 收 洛 阳 宫 回 舆 入 咸 京 席 卷 六 合 通 叱 咤 开 帝 业 手 成 天 地 功 大 驾 还 长 安 两 日 忽 再 中 一 朝 让 宝 位 剑 玺 传 无 穷 愧 无 秋 毫 力 谁 念 矍 铄 翁 弋 者 何 所 慕 高 飞 仰 冥 鸿 弃 剑 学 丹 砂 临 炉 双 玉 童 寄 言 息 夫 子 岁 晚 陟 方 蓬,https://so.gushiwen.org/shiwenv_3c9c67fa1624.aspx
1475,华 晔 晔 固 灵 根 神 之 斿 过 天 门 车 千 乘 敦 昆 仑 神 之 出 排 玉 房 周 流 杂 拔 兰 堂 神 之 行 旌 容 容 骑 沓 沓 般 纵 纵 神 之 徕 泛 翊 翊 甘 露 降 庆 云 集 神 之 揄 临 坛 宇 九 疑 宾 夔 龙 舞 神 安 坐 翔 吉 时 共 翊 翊 合 所 思 神 嘉 虞 申 贰 觞 福 滂 洋 迈 延 长 沛 施 佑 汾 之 阿 扬 金 光 横 泰 河 莽 若 云 增 阳 波 遍 胪 欢 腾 天 歌,https://so.gushiwen.org/shiwenv_428050f57153.aspx
1476,牛 羊 散 漫 落 日 下 野 草 生 香 乳 酪 甜 卷 地 朔 风 沙 似 雪 家 家 行 帐 下 毡 帘,https://so.gushiwen.org/shiwenv_203cdd10d0ca.aspx
1477,暮 蝉 声 尽 落 斜 阳 银 蟾 影 挂 潇 湘 黄 陵 庙 侧 水 茫 茫 楚 山 红 树 烟 雨 隔 高 唐 岸 泊 渔 灯 风 飐 碎 白 蘋 远 散 浓 香 灵 娥 鼓 瑟 韵 清 商 朱 弦 凄 切 云 散 碧 天 长,https://so.gushiwen.org/shiwenv_8584fcd33faf.aspx
1478,日 本 晁 卿 辞 帝 都 征 帆 一 片 绕 蓬 壶 明 月 不 归 沉 碧 海 白 云 愁 色 满 苍 梧,https://so.gushiwen.org/shiwenv_53317842f8f4.aspx
1479,著 意 寻 春 懒 便 回 何 如 信 步 两 三 杯 山 才 好 处 行 还 倦 诗 未 成 时 雨 早 催 携 竹 杖 更 芒 鞋 朱 朱 粉 粉 野 蒿 开 谁 家 寒 食 归 宁 女 笑 语 柔 桑 陌 上 来,https://so.gushiwen.org/shiwenv_2d403ed81fd3.aspx
1480,鸟 道 几 登 顿 马 蹄 无 暂 闲 崎 岖 出 长 坂 合 沓 犹 前 山 石 激 水 流 处 天 寒 松 色 间 王 程 应 未 尽 且 莫 顾 刀 环,https://so.gushiwen.org/shiwenv_0d26262d2b0d.aspx
1481,习 习 谷 风 维 风 及 雨 将 恐 将 惧 维 予 与 女 将 安 将 乐 女 转 弃 予 习 习 谷 风 维 风 及 颓 将 恐 将 惧 置 予 于 怀 将 安 将 乐 弃 予 如 遗 习 习 谷 风 维 山 崔 嵬 无 草 不 死 无 木 不 萎 忘 我 大 德 思 我 小 怨,https://so.gushiwen.org/shiwenv_8539dfce730d.aspx
1482,余 闲 居 爱 重 九 之 名 秋 菊 盈 园 而 持 醪 靡 由 空 服 九 华 寄 怀 于 言 世 短 意 常 多 斯 人 乐 久 生 日 月 依 辰 至 举 俗 爱 其 名 露 凄 暄 风 息 气 澈 天 象 明 往 燕 无 遗 影 来 雁 有 余 声 酒 能 祛 百 虑 菊 解 制 颓 龄 如 何 蓬 庐 士 空 视 时 运 倾 尘 爵 耻 虚 罍 寒 华 徒 自 荣 敛 襟 独 闲 谣 缅 焉 起 深 情 栖 迟 固 多 娱 淹 留 岂 无 成,https://so.gushiwen.org/shiwenv_a744ec018749.aspx
1483,镜 湖 流 水 漾 清 波 狂 客 归 舟 逸 兴 多 山 阴 道 士 如 相 见 应 写 黄 庭 换 白 鹅,https://so.gushiwen.org/shiwenv_b3541e645cb3.aspx
1484,癸 卯 岁 西 原 贼 入 道 州 焚 烧 杀 掠 几 尽 而 去 明 年 贼 又 攻 永 破 邵 不 犯 此 州 边 鄙 而 退 岂 力 能 制 敌 与 盖 蒙 其 伤 怜 而 已 诸 使 何 为 忍 苦 征 敛 故 作 诗 一 篇 以 示 官 吏 昔 岁 逢 太 平 山 林 二 十 年 泉 源 在 庭 户 洞 壑 当 门 前 井 税 有 常 期 日 晏 犹 得 眠 忽 然 遭 世 变 数 岁 亲 戎 旃 今 来 典 斯 郡 山 夷 又 纷 然 城 小 贼 不 屠 人 贫 伤 可 怜 是 以 陷 邻 境 此 州 独 见 全 使 臣 将 王 命 岂 不 如 贼 焉 今 彼 征 敛 者 迫 之 如 火 煎 谁 能 绝 人 命 以 作 时 世 贤 思 欲 委 符 节 引 竿 自 刺 船 将 家 就 鱼 麦 归 老 江 湖 边,https://so.gushiwen.org/shiwenv_b0dc7d922c3d.aspx
1485,平 临 云 鸟 八 窗 秋 壮 压 西 川 四 十 州 诸 将 莫 贪 羌 族 马 最 高 层 处 见 边 头,https://so.gushiwen.org/shiwenv_3270eed7700b.aspx
1486,微 官 易 得 罪 谪 去 济 川 阴 执 政 方 持 法 明 君 照 此 心 闾 阎 河 润 上 井 邑 海 云 深 纵 有 归 来 日 各 愁 年 鬓 侵,https://so.gushiwen.org/shiwenv_1024b4031ce3.aspx
1487,国 初 已 来 画 鞍 马 神 妙 独 数 江 都 王 将 军 得 名 三 十 载 人 间 又 见 真 乘 黄 曾 貌 先 帝 照 夜 白 龙 池 十 日 飞 霹 雳 内 府 殷 红 玛 瑙 盘 婕 妤 传 诏 才 人 索 盘 赐 将 军 拜 舞 归 轻 纨 细 绮 相 追 飞 贵 戚 权 门 得 笔 迹 始 觉 屏 障 生 光 辉 昔 日 太 宗 拳 毛 騧 近 时 郭 家 狮 子 花 今 之 新 图 有 二 马 复 令 识 者 久 叹 嗟 此 皆 骑 战 一 敌 万 缟 素 漠 漠 开 风 沙 其 余 七 匹 亦 殊 绝 迥 若 寒 空 动 烟 雪 霜 蹄 蹴 踏 长 楸 间 马 官 厮 养 森 成 列 可 怜 九 马 争 神 骏 顾 视 清 高 气 深 稳 借 问 苦 心 爱 者 谁 后 有 韦 讽 前 支 遁 忆 昔 巡 幸 新 丰 宫 翠 华 拂 天 来 向 东 腾 骧 磊 落 三 万 匹 皆 与 此 图 筋 骨 同 自 从 献 宝 朝 河 宗 无 复 射 蛟 江 水 中 君 不 见 金 粟 堆 前 松 柏 里 龙 媒 去 尽 鸟 呼 风,https://so.gushiwen.org/shiwenv_7c47313a3245.aspx
1488,尘 中 见 月 心 亦 闲 况 是 清 秋 仙 府 间 凝 光 悠 悠 寒 露 坠 此 时 立 在 最 高 山 碧 虚 无 云 风 不 起 山 上 长 松 山 下 水 群 动 悠 然 一 顾 中 天 高 地 平 千 万 里 少 君 引 我 升 玉 坛 礼 空 遥 请 真 仙 官 云 拼 欲 下 星 斗 动 天 乐 一 声 肌 骨 寒 金 霞 昕 昕 渐 东 上 轮 欹 影 促 犹 频 望 绝 景 良 时 难 再 并 他 年 此 日 应 惆 怅,https://so.gushiwen.org/shiwenv_b8018ba4cd0d.aspx
1489,疾 风 知 劲 草 板 荡 识 诚 臣 勇 夫 安 识 义 智 者 必 怀 仁,https://so.gushiwen.org/shiwenv_dddc7a6ffb15.aspx
1490,国 步 犹 艰 难 兵 革 未 休 息 万 方 哀 嗷 嗷 十 载 供 军 食 庶 官 务 割 剥 不 暇 忧 反 侧 诛 求 何 多 门 贤 者 贵 为 德 韦 生 富 春 秋 洞 彻 有 清 识 操 持 纲 纪 地 喜 见 朱 丝 直 当 令 豪 夺 吏 自 此 无 颜 色 必 若 救 疮 痍 先 应 去 蟊 贼 挥 泪 临 大 江 高 天 意 凄 恻 行 行 树 佳 政 慰 我 深 相 忆,https://so.gushiwen.org/shiwenv_6dbf5cbe93bd.aspx
1491,蝃 蝀 在 东 莫 之 敢 指 女 子 有 行 远 父 母 兄 弟 朝 隮 于 西 崇 朝 其 雨 女 子 有 行 远 兄 弟 父 母 乃 如 之 人 也 怀 婚 姻 也 大 无 信 也 不 知 命 也,https://so.gushiwen.org/shiwenv_9952043eb192.aspx
1492,对 酒 当 歌 人 生 几 何 譬 如 朝 露 去 日 苦 多 慨 当 以 慷 忧 思 难 忘 何 以 解 忧 唯 有 杜 康 青 青 子 衿 悠 悠 我 心 但 为 君 故 沉 吟 至 今 呦 呦 鹿 鸣 食 野 之 苹 我 有 嘉 宾 鼓 瑟 吹 笙 明 明 如 月 何 时 可 掇 忧 从 中 来 不 可 断 绝 越 陌 度 阡 枉 用 相 存 契 阔 谈 讌 心 念 旧 恩 月 明 星 稀 乌 鹊 南 飞 绕 树 三 匝 何 枝 可 依 山 不 厌 高 海 不 厌 深 周 公 吐 哺 天 下 归 心,https://so.gushiwen.org/shiwenv_35000de73cdb.aspx
1493,红 叶 满 寒 溪 一 路 空 山 万 木 齐 试 上 小 楼 极 目 望 高 低 一 片 烟 笼 十 里 陂 吠 犬 杂 鸣 鸡 灯 火 荧 荧 归 路 迷 乍 逐 横 山 时 近 远 东 西 家 在 寒 林 独 掩 扉,https://so.gushiwen.org/shiwenv_36953c3cbd33.aspx
1494,湖 上 青 山 对 结 庐 坟 头 秋 色 亦 萧 疏 茂 陵 他 日 求 遗 稿 犹 喜 曾 无 封 禅 书,https://so.gushiwen.org/shiwenv_03fcd93fd49a.aspx
1495,小 小 生 金 屋 盈 盈 在 紫 微 山 花 插 宝 髻 石 竹 绣 罗 衣 每 出 深 宫 里 常 随 步 辇 归 只 愁 歌 舞 散 化 作 彩 云 飞 柳 色 黄 金 嫩 梨 花 白 雪 香 玉 楼 巢 翡 翠 金 殿 锁 鸳 鸯 选 妓 随 雕 辇 征 歌 出 洞 房 宫 中 谁 第 一 飞 燕 在 昭 阳 卢 橘 为 秦 树 蒲 桃 出 汉 宫 烟 花 宜 落 日 丝 管 醉 春 风 笛 奏 龙 吟 水 箫 鸣 凤 下 空 君 王 多 乐 事 还 与 万 方 同 玉 树 春 归 日 金 宫 乐 事 多 后 庭 朝 未 入 轻 辇 夜 相 过 笑 出 花 间 语 娇 来 竹 下 歌 莫 教 明 月 去 留 著 醉 嫦 娥 绣 户 香 风 暖 纱 窗 曙 色 新 宫 花 争 笑 日 池 草 暗 生 春 绿 树 闻 歌 鸟 青 楼 见 舞 人 昭 阳 桃 李 月 罗 绮 自 相 亲 今 日 明 光 里 还 须 结 伴 游 春 风 开 紫 殿 天 乐 下 朱 楼 艳 舞 全 知 巧 娇 歌 半 欲 羞 更 怜 花 月 夜 宫 女 笑 藏 钩 寒 雪 梅 中 尽 春 风 柳 上 归 宫 莺 娇 欲 醉 檐 燕 语 还 飞 迟 日 明 歌 席 新 花 艳 舞 衣 晚 来 移 彩 仗 行 乐 泥 光 辉 水 绿 南 薰 殿 花 红 北 阙 楼 莺 歌 闻 太 液 凤 吹 绕 瀛 洲 素 女 鸣 珠 佩 天 人 弄 彩 球 今 朝 风 日 好 宜 入 未 央 游,https://so.gushiwen.org/shiwenv_7fe7038c7e7d.aspx
1496,传 闻 合 浦 叶 远 向 洛 阳 飞 北 风 尚 嘶 马 南 冠 独 不 归 去 云 目 徒 送 离 琴 手 自 挥 秋 蓬 失 处 所 春 草 屡 芳 菲 太 息 关 山 月 风 尘 客 子 衣,https://so.gushiwen.org/shiwenv_cf876b9d474b.aspx
1497,陇 头 远 行 客 陇 上 分 流 水 流 水 无 尽 期 行 人 未 云 已 浅 才 通 一 命 孤 剑 适 千 里 岂 不 思 故 乡 从 来 感 知 己,https://so.gushiwen.org/shiwenv_0aa3119ed27c.aspx
1498,楼 前 百 戏 竞 争 新 唯 有 长 竿 妙 入 神 谁 谓 绮 罗 翻 有 力 犹 自 嫌 轻 更 著 人,https://so.gushiwen.org/shiwenv_d9c5fa8508cf.aspx
1499,柳 条 百 尺 拂 银 塘 且 莫 深 青 只 浅 黄 未 必 柳 条 能 蘸 水 水 中 柳 影 引 他 长,https://so.gushiwen.org/shiwenv_3377b5463bcc.aspx
1500,万 里 瞿 唐 月 春 来 六 上 弦 时 时 开 暗 室 故 故 满 青 天 爽 合 风 襟 静 高 当 泪 脸 悬 南 飞 有 乌 鹊 夜 久 落 江 边,https://so.gushiwen.org/shiwenv_6c5b14c0d052.aspx
1501,中 兴 诸 将 谁 是 万 人 英 身 草 莽 人 虽 死 气 填 膺 尚 如 生 年 少 起 河 朔 弓 两 石 剑 三 尺 定 襄 汉 开 虢 洛 洗 洞 庭 北 望 帝 京 狡 兔 依 然 在 良 犬 先 烹 过 旧 时 营 垒 荆 鄂 有 遗 民 忆 故 将 军 泪 如 倾 说 当 年 事 知 恨 苦 不 奉 诏 伪 耶 真 臣 有 罪 陛 下 圣 可 鉴 临 一 片 心 万 古 分 茅 土 终 不 到 旧 奸 臣 人 世 夜 白 日 照 忽 开 明 衮 佩 冕 圭 百 拜 九 泉 下 荣 感 君 恩 看 年 年 三 月 满 地 野 花 春 卤 簿 迎 神,https://so.gushiwen.org/shiwenv_31f6c00d1bce.aspx
1502,金 井 梧 桐 秋 叶 黄 珠 帘 不 卷 夜 来 霜 熏 笼 玉 枕 无 颜 色 卧 听 南 宫 清 漏 长 高 殿 秋 砧 响 夜 阑 霜 深 犹 忆 御 衣 寒 银 灯 青 琐 裁 缝 歇 还 向 金 城 明 主 看 奉 帚 平 明 金 殿 开 且 将 团 扇 共 徘 徊 玉 颜 不 及 寒 鸦 色 犹 带 昭 阳 日 影 来 真 成 薄 命 久 寻 思 梦 见 君 王 觉 后 疑 火 照 西 宫 知 夜 饮 分 明 复 道 奉 恩 时 长 信 宫 中 秋 月 明 昭 阳 殿 下 捣 衣 声 白 露 堂 中 细 草 迹 红 罗 帐 里 不 胜 情,https://so.gushiwen.org/shiwenv_b72d7cb4a548.aspx
1503,朱 鹭 鱼 以 乌 路 訾 邪 鹭 何 食 食 茄 下 不 之 食 不 以 吐 将 以 问 诛 者,https://so.gushiwen.org/shiwenv_d2e5129b0554.aspx
1504,西 山 不 似 庞 公 傲 城 府 有 楼 山 便 到 欲 将 华 发 染 晴 岚 千 里 青 青 浓 可 扫 人 言 华 发 因 愁 早 劝 我 消 愁 惟 酒 好 夜 来 一 饮 尽 千 钟 今 日 醒 来 依 旧 老,https://so.gushiwen.org/shiwenv_936ed669112e.aspx
1505,秋 在 水 清 山 暮 蝉 洛 阳 树 色 鸣 皋 烟 送 君 归 去 愁 不 尽 又 惜 空 度 凉 风 天,https://so.gushiwen.org/shiwenv_09d50584f613.aspx
1506,彼 候 人 兮 何 戈 与 祋 彼 其 之 子 三 百 赤 芾 维 鹈 在 梁 不 濡 其 翼 彼 其 之 子 不 称 其 服 维 鹈 在 梁 不 濡 其 咮 彼 其 之 子 不 遂 其 媾 荟 兮 蔚 兮 南 山 朝 隮 婉 兮 娈 兮 季 女 斯 饥,https://so.gushiwen.org/shiwenv_af9aeae923e6.aspx
1507,露 下 天 高 秋 水 清 空 山 独 夜 旅 魂 惊 疏 灯 自 照 孤 帆 宿 新 月 犹 悬 双 杵 鸣 南 菊 再 逢 人 卧 病 北 书 不 至 雁 无 情 步 檐 倚 仗 看 牛 斗 银 汉 遥 应 接 凤 城,https://so.gushiwen.org/shiwenv_ce5d68ae5f20.aspx
1508,悠 悠 天 地 间 草 木 献 奇 怪 投 老 一 蒲 团 山 中 大 自 在,https://so.gushiwen.org/shiwenv_76e52e00af6d.aspx
1509,麻 衣 如 雪 一 枝 梅 笑 掩 微 妆 入 梦 来 若 到 越 溪 逢 越 女 红 莲 池 里 白 莲 开,https://so.gushiwen.org/shiwenv_900f0e9b714e.aspx
1510,云 鬓 乱 晚 妆 残 带 恨 眉 儿 远 岫 攒 斜 托 香 腮 春 笋 嫩 为 谁 和 泪 倚 阑 干,https://so.gushiwen.org/shiwenv_aa57d5497029.aspx
1511,手 里 金 鹦 鹉 胸 前 绣 凤 凰 偷 眼 暗 形 相 不 如 从 嫁 与 作 鸳 鸯,https://so.gushiwen.org/shiwenv_c7a0149e1ebd.aspx
1512,扬 之 水 不 流 束 薪 彼 其 之 子 不 与 我 戍 申 怀 哉 怀 哉 曷 月 予 还 归 哉 扬 之 水 不 流 束 楚 彼 其 之 子 不 与 我 戍 甫 怀 哉 怀 哉 曷 月 予 还 归 哉 扬 之 水 不 流 束 蒲 彼 其 之 子 不 与 我 戍 许 怀 哉 怀 哉 曷 月 予 还 归 哉,https://so.gushiwen.org/shiwenv_e7444dd52240.aspx
1513,尚 有 绨 袍 赠 应 怜 范 叔 寒 不 知 天 下 士 犹 作 布 衣 看,https://so.gushiwen.org/shiwenv_025417192543.aspx
1514,西 楼 月 下 当 时 见 泪 粉 偷 匀 歌 罢 还 颦 恨 隔 炉 烟 看 未 真 别 来 楼 外 垂 杨 缕 几 换 青 春 倦 客 红 尘 长 记 楼 中 粉 泪 人,https://so.gushiwen.org/shiwenv_229e357e061a.aspx
1515,江 皋 楼 观 前 朝 寺 秋 色 入 秦 淮 败 垣 芳 草 空 廊 落 叶 深 砌 苍 苔 远 人 南 去 夕 阳 西 下 江 水 东 来 木 兰 花 在 山 僧 试 问 知 为 谁 开,https://so.gushiwen.org/shiwenv_22fb73890db3.aspx
1516,古 木 卧 平 沙 摧 残 岁 月 赊 有 根 横 水 石 无 叶 拂 烟 霞 春 至 苔 为 叶 冬 来 雪 作 花 不 逢 星 汉 使 谁 辨 是 灵 槎,https://so.gushiwen.org/shiwenv_16b808ac8b14.aspx
1517,皑 如 山 上 雪 皎 若 云 间 月 闻 君 有 两 意 故 来 相 决 绝 今 日 斗 酒 会 明 旦 沟 水 头 躞 蹀 御 沟 上 沟 水 东 西 流 凄 凄 复 凄 凄 嫁 娶 不 须 啼 愿 得 一 心 人 白 头 不 相 离 竹 竿 何 袅 袅 鱼 尾 何 簁 簁 男 儿 重 意 气 何 用 钱 刀 为,https://so.gushiwen.org/shiwenv_a416ac373919.aspx
1518,风 动 荷 花 水 殿 香 姑 苏 台 上 宴 吴 王 西 施 醉 舞 娇 无 力 笑 倚 东 窗 白 玉 床,https://so.gushiwen.org/shiwenv_600fa093dc03.aspx
1519,江 山 残 照 落 落 舒 清 眺 涧 壑 风 来 号 万 窍 尽 入 长 松 悲 啸 井 蛙 瀚 海 云 涛 醯 鸡 日 远 天 高 醉 眼 千 峰 顶 上 世 间 多 少 秋 毫,https://so.gushiwen.org/shiwenv_75a1570ff533.aspx
1520,终 南 何 有 有 条 有 梅 君 子 至 止 锦 衣 狐 裘 颜 如 渥 丹 其 君 也 哉 终 南 何 有 有 纪 有 堂 君 子 至 止 黻 衣 绣 裳 佩 玉 将 将 寿 考 不 忘,https://so.gushiwen.org/shiwenv_8dc6bfdcb15a.aspx
1521,秋 风 起 兮 白 云 飞 草 木 黄 落 兮 雁 南 归 兰 有 秀 兮 菊 有 芳 怀 佳 人 兮 不 能 忘 泛 楼 船 兮 济 汾 河 横 中 流 兮 扬 素 波 箫 鼓 鸣 兮 发 棹 歌 欢 乐 极 兮 哀 情 多 少 壮 几 时 兮 奈 老 何,https://so.gushiwen.org/shiwenv_515f5c1f245b.aspx
1522,冬 宵 寒 且 永 夜 漏 宫 中 发 草 白 霭 繁 霜 木 衰 澄 清 月 丽 服 映 颓 颜 朱 灯 照 华 发 汉 家 方 尚 少 顾 影 惭 朝 谒,https://so.gushiwen.org/shiwenv_6a31c280e79a.aspx
1523,峰 峦 如 聚 波 涛 如 怒 山 河 表 里 潼 关 路 望 西 都 意 踌 躇 伤 心 秦 汉 经 行 处 宫 阙 万 间 都 做 了 土 兴 百 姓 苦 亡 百 姓 苦,https://so.gushiwen.org/shiwenv_1bd53945715b.aspx
1524,南 国 有 佳 人 容 华 若 桃 李 朝 游 江 北 岸 夕 宿 潇 湘 沚 时 俗 薄 朱 颜 谁 为 发 皓 齿 俯 仰 岁 将 暮 荣 耀 难 久 恃,https://so.gushiwen.org/shiwenv_2b832f229933.aspx
1525,早 梅 发 高 树 迥 映 楚 天 碧 朔 吹 飘 夜 香 繁 霜 滋 晓 白 欲 为 万 里 赠 杳 杳 山 水 隔 寒 英 坐 销 落 何 用 慰 远 客,https://so.gushiwen.org/shiwenv_6cc423183358.aspx
1526,昔 年 戎 虏 犯 榆 关 一 败 龙 城 匹 马 还 侯 印 不 闻 封 李 广 他 人 丘 垄 似 天 山,https://so.gushiwen.org/shiwenv_741322504184.aspx
1527,秋 风 入 窗 里 罗 帐 起 飘 扬 仰 头 看 明 月 寄 情 千 里 光,https://so.gushiwen.org/shiwenv_dff454c6adcb.aspx
1528,剑 阁 横 云 峻 銮 舆 出 狩 回 翠 屏 千 仞 合 丹 嶂 五 丁 开 灌 木 萦 旗 转 仙 云 拂 马 来 乘 时 方 在 德 嗟 尔 勒 铭 才,https://so.gushiwen.org/shiwenv_a31fe4cc7100.aspx
1529,清 溪 流 过 碧 山 头 空 水 澄 鲜 一 色 秋 隔 断 红 尘 三 十 里 白 云 红 叶 两 悠 悠,https://so.gushiwen.org/shiwenv_d8912bd8d7bf.aspx
1530,胜 神 鳌 夯 风 涛 脊 梁 上 轻 负 着 蓬 莱 岛 万 里 夕 阳 锦 背 高 翻 身 犹 恨 东 洋 小 太 公 怎 钓,https://so.gushiwen.org/shiwenv_8db6f855a3d5.aspx
1531,承 乐 世 董 逃 游 四 郭 董 逃 蒙 天 恩 董 逃 带 金 紫 董 逃 行 谢 恩 董 逃 整 车 骑 董 逃 垂 欲 发 董 逃 与 中 辞 董 逃 出 西 门 董 逃 瞻 宫 殿 董 逃 望 京 城 董 逃 日 夜 绝 董 逃 心 摧 伤 董 逃,https://so.gushiwen.org/shiwenv_1a18a239d0c7.aspx
1532,精 华 欲 掩 料 应 难 影 自 娟 娟 魄 自 寒 一 片 砧 敲 千 里 白 半 轮 鸡 唱 五 更 残 绿 蓑 江 上 秋 闻 笛 红 袖 楼 头 夜 倚 栏 博 得 嫦 娥 应 借 问 缘 何 不 使 永 团 圆,https://so.gushiwen.org/shiwenv_529b54e1c408.aspx
1533,重 冈 已 隔 红 尘 断 村 落 更 年 丰 移 居 要 就 窗 中 远 岫 舍 后 长 松 十 年 种 木 一 年 种 谷 都 付 儿 童 老 夫 惟 有 醒 来 明 月 醉 后 清 风,https://so.gushiwen.org/shiwenv_ffc5956b3eba.aspx
1534,蘋 叶 软 杏 花 明 画 船 轻 双 浴 鸳 鸯 出 绿 汀 棹 歌 声 春 水 无 风 无 浪 春 天 半 雨 半 晴 红 粉 相 随 南 浦 晚 几 含 情,https://so.gushiwen.org/shiwenv_b6b95d9806c2.aspx
1535,晋 十 有 四 年 余 春 秋 三 十 有 二 始 见 二 毛 以 太 尉 掾 兼 虎 贲 中 郎 将 寓 直 于 散 骑 之 省 高 阁 连 云 阳 景 罕 曜 珥 蝉 冕 而 袭 纨 绮 之 士 此 焉 游 处 仆 野 人 也 偃 息 不 过 茅 屋 茂 林 之 下 谈 话 不 过 农 夫 田 父 之 客 摄 官 承 乏 猥 厕 朝 列 夙 兴 晏 寝 匪 遑 卮 宁 譬 犹 池 鱼 笼 鸟 有 江 湖 山 薮 之 思 于 是 染 翰 操 纸 慨 然 而 赋 于 时 秋 也 故 以 秋 兴 命 篇 其 辞 曰 四 时 忽 其 代 序 兮 万 物 纷 以 回 薄 览 花 莳 之 时 育 兮 察 盛 衰 之 所 托 感 冬 索 而 春 敷 兮 嗟 夏 茂 而 秋 落 虽 末 士 之 荣 悴 兮 伊 人 情 之 美 恶 善 乎 宋 玉 之 言 曰 悲 哉 秋 之 为 气 也 萧 瑟 兮 草 木 摇 落 而 变 衰 憀 栗 兮 若 在 远 行 登 山 临 水 送 将 归 夫 送 归 怀 慕 徒 之 恋 兮 远 行 有 羁 旅 之 愤 临 川 感 流 以 叹 逝 兮 登 山 怀 远 而 悼 近 彼 四 戚 之 疚 心 兮 遭 一 涂 而 难 忍 嗟 秋 日 之 可 哀 兮 谅 无 愁 而 不 尽 野 有 归 燕 隰 有 翔 隼 游 氛 朝 兴 槁 叶 夕 殒 于 是 乃 屏 轻 箑 释 纤 絺 藉 莞 箬 御 袷 衣 庭 树 槭 以 洒 落 兮 劲 风 戾 而 吹 帷 蝉 嘒 嘒 而 寒 吟 兮 雁 飘 飘 而 南 飞 天 晃 朗 以 弥 高 兮 日 悠 阳 而 浸 微 何 微 阳 之 短 晷 觉 凉 夜 之 方 永 月 瞳 胧 以 含 光 兮 露 凄 清 以 凝 冷 熠 耀 粲 于 阶 闼 兮 蟋 蟀 鸣 乎 轩 屏 听 离 鸿 之 晨 吟 兮 望 流 火 之 余 景 宵 耿 介 而 不 寐 兮 独 辗 转 于 华 省 悟 时 岁 之 遒 尽 兮 慨 伏 首 而 自 省 斑 鬓 髟 以 承 弁 兮 素 发 飒 以 垂 领 仰 群 俊 之 逸 轨 兮 攀 云 汉 以 游 骋 登 春 台 之 熙 熙 兮 珥 金 貂 之 炯 炯 苟 趣 舍 之 殊 涂 兮 庸 讵 识 其 躁 静 闻 至 人 之 休 风 兮 齐 天 地 于 一 指 彼 知 安 而 忘 危 兮 故 出 生 而 入 死 行 投 趾 于 容 迹 兮 殆 不 践 而 获 底 阙 侧 足 以 及 泉 兮 虽 猴 猿 而 不 履 龟 祀 骨 于 宗 祧 兮 思 反 身 于 绿 水 且 敛 衽 以 归 来 兮 忽 投 绂 以 高 厉 耕 东 皋 之 沃 壤 兮 输 黍 稷 之 余 税 泉 涌 湍 于 石 间 兮 菊 扬 芳 于 崖 澨 澡 秋 水 之 涓 涓 兮 玩 游 鲦 之 澼 澼 逍 遥 乎 山 川 之 阿 放 旷 乎 人 间 之 世 悠 哉 游 哉 聊 以 卒 岁,https://so.gushiwen.org/shiwenv_baf9bf442768.aspx
